id,text
1099328372684089984,"Pregunta Para Dummies: Si @usuario ordenó al ejército de EEUU disparar contra los migrantes desarmados que pretendieran ingresar a USA, por qué el Dr Maburro no puede ordenar lo mismo para hashtag venezuela ? Es para una tarea, XQ no hemos podido entender, X Q el mono si puede?"
1257990138858299904,"@usuario @usuario Hola Gato!! Buenos días!! Ya habrá empezado a llevar ladrillos, arena, piedra, hierros de 14 para la Frontera con Brasil?? Con 6 metros de altura esta bien, y arriba por las dudas 2 metros de alambre electrificado.."
1267124809638510080,"@usuario Parte es consecuencias de la inmigración descontrolada, se importó mucha pobreza."
1370493332737110016,@usuario PARA CUANDO TE LLEVAS A LOS MILLONES DE COLOMBIANOS QUE ESTAN AQUI EN VENEZUELA.
1298120759752250112,"@usuario @usuario Yo creo, que la solución , no es cerrar las fronteras, porque eso atrae más ilegales que pasan por cualquier puesto fronterizo y quedan piolas. En cambio el abrir fronteras ( desde el punto de vista de JAZ) se controla 100% , osea con Visa de trabajo, o sino"
1273840976692420096,@usuario emoji cara revolviéndose de la risa emoji emoji cara revolviéndose de la risa emoji ven a ver a Chile el ejemplo de hogiene que dan tus inmigrantes
1154909160959589888,@usuario @usuario Exacto. Entre mas empleo. Menos migrantes y tener mas oportunidades en nuestro propio pais emoji pulgar hacia arriba emoji emoji pulgar hacia arriba emoji
1135779445015430016,@usuario Al peje le importan más los inmigrantes y los narcos que los aranceles que nos pongan Trump.
1351300769639749888,"@usuario Desigualdad y pobreza, vinieron d su 1er Gob y continuó en el segundo!! La corrupción se apoderó del país hasta el día de hoy. Lo peor fué la inmigración descontrolada q usteded provocó, generando más desespleo luego haciendo crecer el Estado.Todo lo q hizo fue un desastre!! emoji cara cabreada emoji"
1378105687536979968,@usuario @usuario @usuario 100 de venezolanos en Peru me convencieron de no votar nunca por los COMUNISTAS
1385296881425789952,FBI Y NO CONTROLAN NI EL GATILLO LA POLICÍA DE USA. @usuario @usuario SI TODO INMIGRANTE Y LATINO SE FUERA DE USA QUE SERIA DE USA QUIEN TRABAJARÍA SI EL GRINGO NLANQUITO NO SABE HACER LO QUE HACE EL INMIGRANTE Y LATINO. Conoce debilidades de cada nación y no las repitas
1167505832604519936,"Hoy me puse un suero de vitamina C en un Centro Cosmetologico y me lo puso una enfermera venezolana. En Perú tienen que convalidar el título y cuesta 3 mil dólares, aquí sólo tienen que registrarlo en el Senecyt, dura 10 días y sin costo. Y para nuestros profesionales no hay trab"
1197864156860430080,@usuario @usuario @usuario @usuario @usuario @usuario @usuario @usuario @usuario @usuario @usuario @usuario @usuario @usuario Se debe cerrar esa frontera con Vzuela definitivamente
1255952239589499904,"Amigos hashtag venezolanos mientras vivan en este techo, MI TECHO Colombia, obedecen las reglas , ok? Si no.. Bien pueden regresashh"
1177965259149270016,@usuario No olvidemos esto jamas.Peru Ecuador Chile.Siempre seran lo q son.Pueblos incultos q temen a gente Superior Y hablo de preparacion intelectual y profesional venga d donde venga Vnzla renacera mas prospera y fuerte q nunca y la migracion cambiara de sentido.Alli la dulce venganza
1203680598058919936,"Eso incluye a sus migrantes. Ellos no pueden votar, como no debería tampoco ningún beneficiario de sus ayudas sociales."
1374139886329070080,"@usuario @usuario Ya es tarde Lady ,del día que permitieron entrar gente ,del exterior ,sea el motivo que sea ,el presidente tendría que haber tomado medidas al respecto y cerrar todo tipo de fronteras ,nadie entra ,nadie sale ,ese es el peor error para mi !!"
1288798390776669952,"Que dice, la que dijo que le habían dado una pedrá, que el feminismo es responsable de miles de muertos por la COVID. Y los rebrotes actuales, son causa de los inmigrantes que recogen la fruta. La cicatriz la debe llevar bien maquillada, no se le nota nada. HA DICHO"
1198672535686129920,"@usuario @usuario En la mañana pasé por ahí y de verdad estaba muy lleno de basura, no creo que hayan sido los inmigrantes"
1114316036130659968,El inmigrante hijo de yuta de mi novio me hace agarrar un mal humor
1139175371985699968,"Encuentro cuatico que alguien se sienta más cómodo en otro país que el propio. Por eso me cargan las leyes de inmigración de casi todos lados incluyendo Chile, uno debería ser libre de irse y estar donde se siente bien"
1218529925587699968,"Esos hijos que son mayorcitos y tan de sus padres, que se vayan con ellos a los asilos o que dejen de explotar inmigrantes que los cuiden.. En qué momento deja el hijo de pertenecerles? Ay omá. hashtag criando personas"
1363653043829550080,"@usuario @usuario ¿Quieres justicia para todos?, ¿Qué hay de los que viven la inseguridad día a día gracias a ésta migración? Cusco es más tranquilo que Lima. Si vivieras en los distritos limeños de SJL, SMP, o Chorrillos, tal vez exigirías a todo pulmón, que haya más control con ésta migración."
1232244993424790016,"@usuario hombre, pues con no dejar entrar a extranjeros sobra, ahh no, q eso va en contra d la economía, pues nada"
1155093756984669952,"@usuario @usuario Con la ayuda de diputados como ustedes, que en vez de trabajar para Chile, trabajan para sus bolsillos, es fácil recriminar de la vereda opuesta, migración sin control, todo lo rechazan, que esperan que los hashtag tiemposmejores se hagan de milagro?"
1101880322466200064,@usuario @usuario @usuario Todos dicen q en Venezuela pasan hambre y lo único q veo n los inmigrantes venezolanos pantalones d marca celulares d última tecnología etc.y todos robustos y n vez d buscar trabajo piden caridad. Hambre es ésto emoji dorso de mano con índice hacia abajo emoji o es que ellos no son seres humanos para llevar ayuda humanitaria? url
1238606350667719936,@usuario @usuario @usuario @usuario @usuario @usuario @usuario @usuario Hay que cerrar la frontera señor alcalde antes que sea tarde @usuario hashtag duque cierre las fronteras ya
1297872161823229952,"No hace falta decir que el crimen, sin decirlo, se entiende como una consecuencia de la inmigración y la falta de integración (palabras q en Suecia van siempre asociadas). En un momento de su discurso, el moderado se refiere a Dinamarca ¿Va a comparar la gestión del Coronavirus?"
1268103049144339968,"@usuario @usuario los extrajeros no es malo como tal, lo malo es cuando es una migracion masiva, daña la economia de un pais, y tambien la cultura, ahi queda perjudicada la cultura del pais local, ni hablar cuando es ilegal como paso con EEUU desde el sur."
1325437922892539904,@usuario @usuario Esta es la política de inmigración de Colombia emoji signo de interrogación emoji emoji cara cabreada emoji emoji signo de interrogación emoji
1339723608730599936,Es importante llevar un control de la migracion venezolana en Trinidad en acuerdo con sus autoridades solo asi se puede acabar el negocio de trata..pero esta claro que la trata alimenta prostitucion y seguro esclavitud del siglo XXI
1311141095024280064,"@usuario emoji señal de stop emoji Querida @usuario NO olvidemos que @usuario Le dió refugio político a este TERRORISTA ex Sendero Luminoso, Rodolfo Noriega y encima le dió un puesto en la Coordinadora Nacional de inmigrantes!! emoji dorso de mano con índice hacia abajo emoji hashtag fuera terroristas de chile url"
1101971712881639936,"@usuario @usuario @usuario Con con un indice delictivo y de homicidio increible (ni en guerras) con un alto nivel de desnutricion, el salario mas bajo de latonoamerica, crisis migratoria.."
1132126647484860032,@usuario En Chile somos alrededor de 300.00 venezolanos. Hallar un empleo con contrato es cada vez más difícil. La llegada rápida y masiva de migrantes va a generar un ambiente más precarizante.
1175910390468940032,"Esto lo explica todo, las caravanas de migrantes ahora van en sentido contrario, todos al sur -hasta los pinches güeros mariguana van a madres- a ganar quetzales.."
1080503018464920064,@usuario @usuario @usuario @usuario Yo no digo que inmigración sea la causa de los problemas. Es un problema nuevo más para los pobres. Por cupo empleo atención etc que no se va arreglar por qué llegaron. Al contrario. Ese es mi punto
1343997683481110016,"Yo sé que esto está mal, pero en estos momentos dónde hoy se sabe si se aprueba una ley o no en Argentina, que vengan de otros países a tirar mierda provida me pone xenofobica. Podés cerrar el orto y respetar las fronteras forro de mierda jshskala que hija de puta"
1175806960660369920,Ahora saldrán los venezolanos en Perú a decir que el peruano que te amenazó tenía razón.
1291940253763340032,@usuario Me Preocupa la realidad de esas rutas del Istmo.. ¿Realmente hay una estrategia de base para ese proyecto? ¿Veremos hacerce realidad? ¿No será nueva ruta de migrantes y delincuencia? ¿El sueño del porfirismo sobre el Istmo es suficientemente moderno para nuestros días? emoji cara con monóculo emoji
1189701067564549888,@usuario @usuario Entonces los venezolanos que hay en Chile son alienígenas. Jejeje
1321891553976219904,"@usuario Esto hay que pararlo. Vienen aquí sin una cultura social democrática y pacífica, pero con todos los derechos que las naciones unidas otorgan al refugiado o migrante. Los políticos no están siendo capaces de solventar este gravísimo problema."
1089599990392070016,"@usuario Y otras plagas más.Todas de mucho cuidado.Mientras su pdte, tiene el gobierno cerrado x su capricho de impedir la inmigración centroamericana.Irreal!🤦 emoji tono de piel claro emoji ‍!"
1241434521058390016,"@usuario @usuario @usuario @usuario @usuario No puede ser verdad .. 🤦 emoji tono de piel claro emoji ‍ suben los impuestos, tarifas miles de personas al seguro de desempleo entre otros y tenemos que sacar de nuestro bolsillo ? Ahora q se hagan cargo xq no tomaron a tiempo medidas cierre de frontera controles cuarentena obligatoria !!"
1136798911274899968,"Primero hace pública invitación a migrantes ofreciéndoles trabajo lo que provocó caravanas y caravanas de ilegales. Cuando las consecuencias de su torpeza tienen o pueden tener consecuencias en la economía, organiza un mitin en favor de la ""bonita amistá."" Ganso pendejo."
1197515001835200000,@usuario Inmigración ilegal
1159824110140229888,@usuario @usuario La clave alli es inmigracion ORDENADA. En Chile es un desorden absoluto!
1120689157230220032,"@usuario @usuario Se han creado muchos puestos de trabajo, lamentablemente el gobierno pasado aumentó mucho los puestos politicos que no hacían nada, además de la llegada masiva y sin control de inmigrantes, tráfico humano de M. Bachelet."
1144973977024120064,Que razón hay para entender que Rapa Nui tiene capacidad finita de recibir inmigrantes y el resto de Chile no tiene límites?
1157129194326779904,"@usuario KAKAST NO ES CHILENO AWEONAO, ES HIJO DE MIGRANTES. NO MERECE SER PRESIDENTE. url"
1359299846834970112,"El presidente de Colombia hace algo con pantalones respecto a migrantes.. bien ahí!! emoji manos aplaudiendo emoji emoji manos aplaudiendo emoji nuestro @usuario su ministrillo @usuario el cancilleruso @usuario viven en un mundo paralelo.. militares, drones.. puaj!! Que termine pronto este suplicio por favor."
1220834528870070016,@usuario Justo hace rato me encontré con un grupo de centroamericanos inmigrantes. Y pues como señalan muchas personas aquí: groseros y agresivos.
1223590846001499904,"@usuario Porque sólo destacan en el titular delincuente venezolano, porque por supuesto llama más la atención colocar ""venezolano"", Ej: atraparon dos delicuentes de la banda x en Perú, dónde uno es peruano y el otro venezolano."
1313902033855020032,"@usuario Que se abran las investigaciones a fondo a los gerentes de los canales de televisión y radio del Perú por editar, desviar y manipular la información a los peruanos OCULTANDO las nacionalidades de DELICUENTES y PROSTITUTAS VENEZOLANAS en Intervenciones POLICIALES."
1124037339716760064,"@usuario Yo soy inmigrante, si no puedo opinar ok. Pero quiero estar exento de impuestos."
1324675217155849984,"@usuario Fresitas al ataque, desde su muy privilegiada posición, y sin hacer colas, le piden a 11millones más 1 millón de inmigrantes que vayan en 2 días a vacunarse contra la ""mortal"" difteria que ya se llevó DOS personas, si, DOS, no los casi 40MIL del COVID-19, no, solo DOS.. Vah.."
1239379912991140096,"Bueno, es Brasil CERRAR FRONTERAS APRENDER"
1371102418918909952,@usuario Si hablamos de contradicción ud se pronuncia de los bombardeos a los guerrilleros pero no dice nada cuando un migrante asesina a un ciudadano de bien por robarlo.
1182317986952160000,"Venezuela, en lugar de agradecer a Brasil por recibir a sus inmigrantes, sigue saboteando."
1142810004946339968,"@usuario los países como Chile se dan cuenta que esto va para largo y que la ola migratoria va a seguir creciendo ,cada día más controles .No se puede alargar más este asunto .El venezolano no da más .Sos"
1354594692986510080,"Lo peruanos tienen más cojones q los chilenos, no los convencen con droga y 10% ..chile lo convirtieron en nidos d los políticos corruptos amigos d los narcos..y no hacen nada p esta llegada de migrantes buenos y malos..nuestro amado pais lo están reventando"
1137025498406509952,"@usuario @usuario El idiota de obrador, esta afectando la seguridad nacional de Mexico al mantener la frontera sur abierta y deja entrar al pais a toda clase de gente sin verificar si tienen antecedentes penales o no. Es una lastima que todabia lo apoyen en sus pendejadas."
1219988678602149888,"@usuario @usuario Si, si.. desplazados por las guerrillas narco-comunistas.. que me dice de los 5 millones de venezolanos que ""turistean"" a pie por el mundo gracias al amigote de Petro.."
1250158097303320064,"@usuario @usuario hashtag apoyo en bucaramanga Señor presidente @usuario @usuario el departamento de Santander requiere atención especial y apoyo inmediato, toda vez que la presencia de migrantes, cada vez es numerosa, poniendo en peligro la vida de todos los asociados @usuario"
1216712717500809984,@usuario @usuario Pasaremos aa historia como la peor emigración del siglo XXI. aquí en ecuador la cosa no es diferente uno va a las zonas de discotecas y los que lideran el microtrafico de estupefacientes son colombianos y venezolanos.
1391432532516879872,"@usuario uno detestabas esa estúpida política migratoria de libre movilidad y ciudadanía universal, el chulquero se ha pronunciado a favor de un montón de libertades entre esas continuar con esta situación. Esque la embajada entrometida injerencista les obliga para q nieguen el bloqueo"
1250483491759940096,@usuario yo me acuerdo que en venezuela todas las putas eran colombianas y todovia son putas todas
1396068679696150016,"Y luego hablan de xenofobia y no se dan cuenta que no los quieren por ellos mismos. La dignidad de esos ""venezolanos"" por el piso"
1135699256084390016,"@usuario @usuario @usuario @usuario Pero qué tal, anduvieron de pinches alcahuetes fomentando y apoyando las caravanas de migrantes con los putos de derechos humanos, la policía y y toda la caterva que movilizaron para acompañar a los chingaos migrantes. Ahora están de putos llorando por el 5%"
1368667706514409984,"@usuario Votas por bachelet, apoyas el gobierno de Piñera, o sea eres mas onunista que cualquiera!! Defiendes a los empresarios vende patria que quieren inmigrantes para bajar los sueldos!!"
1187544245055510016,"Mírese no más un presidente de izquierda, dándole gracias a uno ultra derecha racista a más no poder y además agresivo , grosero, no entiendo AMLO por qué celebra el que Mexico sea un muro con los migrantes"
1137169307165699968,"Por ahora la narcocracia mexicana salinista-zedillista-bushista exportadora se salvó. Pero si @usuario no detiene a hordas migrantes de SOROS, el presidente @usuario @usuario tomará medidas más fuertes y radicales."
1363697509273649920,@usuario xq tantos venezolanos muertos d hambre perseguidos x la Dictadura huyen dl paraíso comunista?? Xq no son capaces d defender su país? Ojalá alguien le corte el oxigeno al Dictador
1134261537915449984,@usuario En una guerra comercial con USA Mexico es un niño recién nacido.. lo mejor será considerar la idea de cero tolerancia hacia los migrantes hasta que el plan para LATAM esté en operación
1357486882351909888,"Yo estoy de acuerdo con que se de asilo a quienes son perseguidos por razones políticas pero, los migrantes que están llegando ahora, no lo son. Alguien publicó que -si no encuentran trabajo, van a delinquir- El problema es que, por ej., en Iquique, los colombianos venden droga."
1156168550039600128,"@usuario No es precisamente la migración la que está destruyendo a Chile señor migrante.. Porque ud, por su apellido, es migrante, si? A no ser que su apellido de marca de cerveza sea porque le hace mucho al producto de la cebada fermentada, lo que puede explicar algunas cosas."
1362312850148969984,"@usuario Jjaja hay que buscar la visa, pero de inmigrante. emoji cara llorando de risa emoji"
1135735683736150016,@usuario EL PROBLEMA SON LOS QUE LLEGAN SIN REGISTRO ILEGALMENTE. No solonlos gringos que coordinan las caravanas migrantes con visa de usa.
1171703467028689920,Inmigración excesiva en Chile es el peor error en 50 años sólo aporta a disminuir felicidad de los chilenos
1373651822016090112,"@usuario Porque al igual que los hijos de inmigrantes Alemanes en su momento, en su mayoría, y para bien o mal, ya son chilenos. El estado debe hacerse cargo de la migración que aceptó, no dejan de ser inocentes niños."
1393996666714429952,@usuario Que barbaridad hablas! Todos uds y sus funcionarios progres son quienes promueven el caos y la decadencia en éste país. A ella le debemos la migración descontrolada q promueve la delincuencua. CÍNICOS!!
1367065207219049984,*TODO CADA DÍA PEOR.. CONTINUARÁ LA EMIGRACIÓN DE VENEZOLANOS emoji dorso de mano con índice a la derecha emoji * El Nacional: Más de 500 venezolanos caminan cada día cerca de la frontera Colombia-Ecuador.
1251867987449129984,@usuario Los 3 inmigrantes que se observan están poniendo en riesgo de muerte a la ciudadanía del país que los recibe y acoge.. y de paso se hacen las víctimas con otro paisano que grabo el video desde arriba quizás hasta un dinerito sacaron. (en su país de origen los hubieran torturado)
1274083216597669888,"@usuario @usuario @usuario @usuario Esa es la mentalidad parasita de la izquierda. Inmigrantes en busca de paguitas, llegan aqui a pedir derechos que en su pais jamas serian capaces de pedir. Falsos y cobardes..quieren en un dia lo que en su pais jamas han tenido. Vete a la mierda parasito."
1233918371709829888,"@usuario Que alguien le explique a este malandro del micrófono, que en los últimos 4 años han entrado a Colombia dos millones de venezolanos. Estúpido."
1220856186997590016,"@usuario No los están agrediendo, ellos entraron por la fuerza como los inmigrantes pasados, no veo porque en su momento les molesto y ahora no, aparte son personas que sino logran pasar a estados unidos se quedarán en México donde no trabajan, solo viven de lo que la gente les da"
1344783787058670080,@usuario @usuario @usuario @usuario @usuario @usuario @usuario Es urgente que el gobierno ponga un alto a la migración de colombianos y venezolanos. @usuario
1356631774365939968,"Venezolanos ofrecen empleo a los inmigrantes venezolanos y son estafadores, actúan como Casa de Cambio, ofrecen emoji bolsa de dinero emoji más altos para q caigan emoji símbolo de socorro emoji"
1233536608399429888,"@usuario Todo el problema que se ido incrementando y creciendo Al presidente de Colombia Iván Duque es culpa del régimen usurpador de Nicolás Maduro, porque la diáspora de migrantes venezolanos ha desbordado y a llevado a el país a un caos total."
1306795693579869952,"@usuario Lástima que no puedo hacerlo mismo con los más 5 millones de Colombianos que viven en Venezuela, producto del Narcoestado, malas políticas y persecución militar. Y lo más irónico es que no se devuelven. Tranquilo aquí viven feliz en la Revolución Bolivariana. url"
1224155529074889984,"@usuario La vida de un delincuente no vale nada, acá un Venezolano mato a quema ropa de un tiro a una sra por robarle el bolso fuera de un CC, que recomienda hacer con el criminal?"
1088110296852499968,@usuario @usuario DEBE SER POR AMLO QUE USA ESTA LLENO DE INMIGRANTES MEXICANOS
1371216466847150080,@usuario A qué te refieres petiso? A dejar entrar venezolano con antecedentes penales? Y fueron los que apoyaban a Macri? Y el que asesino a turista extranjeros? Se más claro @usuario.
1360372064503419904,@usuario Con la aprobacion de la migracion por parte de Duque se incrementara la miseria en un 10%
1094650402807660032,@usuario Acá en EEUU ya están comprendiendo porque de la insistencia del Muro y las restricciones a la inmigración que quiere imponer Trump
1325815675101839872,"@usuario Y estamos llenos de migrantes, indocumentados y pasando grandes dificultades, qué hacer? @usuario"
1301219881313019904,Deben cerrar las fronteras hasta reorganizar el.pais del desastre económico y laboral
1375290126268470016,Enano qlio. Cierra las fronteras o andate a Brasil a weveaar csm
1271594345922210048,"@usuario No es un problema cultural, mucha gente saliendo sin tener que hacerlo, y sin discriminar pero ahora se ve lo peligroso de la inmigración sin control"
1289560201108979968,hashtag colombia El terror como forma de control social. Venga de donde venga. Duele que venezolanos/as estén atrapados en ese horror adoptado al migrar. Duele q el pueblo colombiano no tenga respiro. Sí. Me duele el pueblo colombiano. No me salgan con xenofobia porque no me la calo
1166518383224989952,"@usuario Vicepresidenta, debe empoderarse de estos delitos y llevarlos a la justicia. Sea venezolano o colombiano. Esto pasa diario en Colombia!"
1267294982840420096,@usuario Después lloran que les ponen un muro en la frontera y los deportan
1143555440149560064,@usuario Y qué quieres? Que les den libre tránsito? El cruzar la frontera sin la documentación correspondiente es ilegal y se debe evitar
1351832405745789952,"@usuario @usuario @usuario @usuario @usuario El mundo entero son aquellos que defienden cuotas y demás para inmigrantes. O sea, que quieren que se les trate diferente por su raza. Y los racistas son los otros. Igual que las mujeres. Pero los machistas son otros."
1156012194938540032,"Yo podría decirte que los venezolanos ""le matamos el hambre a esos inmigrantes"", como lo dijo más de un soplapolla venezolano, como lo dices tú hoy de forma mucho más educada."
1311987817808100096,@usuario Las leyes en USA deben de cambiar ser más rigurosa en cuanto a los inmigrantes. Dígame que va a ser una mujer con hijos sola en un país extranjero. El que quiera ir a USA que lo intente de manera legal. Sea profesional genere interés y luche para lograrlo
1266778533466080000,@usuario Y que hizo Ud Sra Bachelet? Dejo entrar 1 millón de inmigrantes. Quien asume eses costo ahora? No tiene moral para hablar.
1111943274326080000,"@usuario @usuario Usted ha buscado en cuánto está el índice de consultas de urgencias en los municipios de frontera a causa del éxodo venezolano?.. se cuadruplicó y si los hospitales estaban en crisis antes, imagine ahora! Le dejo esa perla!!"
1249002776765530112,"A ver, a ver, con Uribe NO se meta. Este NO es su país, igualada. Coja sus chécheres y a la frontera. Aquí no queremos migrantes de su calaña. Respete MI país que NO es el suyo. Ustedes dejaron acabar Venezuela. Regrese. Aquí no joda. url"
1098763895278370048,"@usuario @usuario @usuario @usuario No por el echo de ser inmigrantes, y que tengan los mismos derechos por su pago a México, significa que hagan está clase de cosas. Se que no son todos, estoy consciente. Pero como evitas, que esto suceda?."
1149311172958649984,"@usuario @usuario Los adoloridos son los que se quejan. Los que aún no los ha afectado este fenómeno migratorio, siguen diciendo que hay que dejarlos vivir su vida. Por mi que la vivan de donde vinieron."
1359264133691150080,"Tamara Acosta habla desde su burbuja, no comprende que la gente pobre chilena está siendo discriminada y siendo desplazada por esta inmigración descontrolada. hashtag holala red chile"
1362129950254500096,"@usuario En eso no pensaron los que van declarando la guerra a Perú, creo que solo va a parar hasta que alguien tire por un puente a un venezolano, el hampa venezolano no razona con logica, solo son unos salvajes que no piensan en las consecuencias"
1306634491444720128,"@usuario O sos retrasada o sos kirchnerista. Vos bien sabes que cuando hablamos de esos inmigrantes nos referimos a la gente de Bolivia o Paraguay que cruzan la frontera a cobrar jubilaciones cuando en su puta vida aportaron algo en nuestro país, lo mismo con la salud y planes sociales."
1346350068459310080,"@usuario Menos mal que aquí en la península, no puedo morir por coronavirus (siempre que no me junte con inmigrantes, claro. Por eso no me junto con el Emérito ni su mujer, no sea que me contagien)"
1239305070073860096,Debido al Gobierno ineficiente y las estructuras de salud deterioradas en Colombia se agudizará la pandemia hashtag coronaviruscolombia para pesar de los Venezolanos el Norte de Santander será nuestra pesadilla por eso máxima conciencia¡¡ url
1182432095207150080,"@usuario En el Ecuador hay cerca de 500 mil venezolanos gracias a las puertas abiertas a todo el mundo ahora que se quejan, si hasta transporte les daban para su ingreso. Con la brillante lógica de Moreno y la suya entonces todos son financiados por Maduro y Correa. Se pasan de ridiculos"
