id,text
1155147509863529984,@usuario Que visite los colegios municipales y verá la realidad. Salas colapsadas con alumnos mayoritariamente migrantes emoji cara cabreada emoji
1160292331175719936,"@usuario Cómo así enviarlos a la cárcel acá en Colombia, cuántos colombianos hay presos en Venezuela les apuesto que en 3 días máximo están otra vez robando aca en Bogotá que falta de justicia en este país"
1134844005970339968,Cuando los que hoy esperan en la frontera norte sean menos de mil. Si queremos dejemos entrar a tres mil y así.
1198955349698650112,"@usuario @usuario Sillas, muertos, inmigrantes, niños.. todo lo qué sume a su causa y puedan desechar a la primera."
1141904605183379968,@usuario Nos va terminar saliendo más barato hacer un muro en la frontera sur y que lo paguen los hermanos centroamericanos emoji cara revolviéndose de la risa emoji emoji cara llorando de risa emoji emoji cara revolviéndose de la risa emoji
1206575673361469952,EL GENOCIDA MADURO TIENE QUE TENER PERSONAS DENTRO DEL TERRITORIO VENEZOLANO A TODA COSTA PARA VEERSE COMO PAIS!! POR ESO LOS PASAPORTES SON ORO EN POLVO!! url
1341235068107409920,"Que tal que Venezuela excluya a los más de 6 millones de colombianos que hay allá?. Antes de que los venezolanos emigraran a Colombia, fueron más de 6 millones los colombianos que emigraron a Venezuela, y que aún siguen allá. url"
1082296662553440000,@usuario @usuario @usuario @usuario Uno de los problemas es generar otro problema?? Qué pasará con Colombia si estalla un conflicto bélico en el vecino país? No habrá más migrantes?? Y muchos colombianos en la misma situación?.
1136707812816429952,@usuario Gente como tú no debería ser llamado mexicano. Realmente es un asunto de dignidad más que de políticas migratorias y aranceles. El país está siendo chantajeado y ¿prefieres seguir con tus prejuicios vs el gobierno actual de México? Que asco me da la gente como tú.
1087824194627399936,"""El control migratorio detiene a los extranjeros, no a la violencia de género"" IMPORTANTE."
1136783469890230016,"@usuario Simplemente es proteger la seguridad de MÉXICO, con tanto migrante malandro que viene."
1139619353102560000,"Tanto que se beneficiaron los Colombianos en Venezuela, que hasta malas prácticas llevaron al País, y ahora se lavan las manos como Ponciu Pilatus. Ayuden a Venezuela.. No se haga los indiferentes."
1247618186482249984,"@usuario ""Denme, alimenteme, vistanme, duermanme, bañenme, llevenme, traiganme, ponganme, dejenme, regalenme, entreguenme, ¡quiéranme!""-Pidió el migrante Venezolano."
1359292343078249984,@usuario Porque apoyan esta ley que favorece a los inmigrantes venezolanos y diprime la calidad de vida aún más del pueblo hambriento de Colombia qué le toca buscar alternativas porque no hay trabajo el gobierno no lo genera después se dedican sólo a perseguir a la clase que se rebusca
1334842272710599936,Dostora explique el ingresox el norte inmigrantes a Chile en Pandemia y todos los dias en Buses cruzando 4 o 5 paises .Y un Chileno para viajar tiene muchas limitaciones hashtag bienvenidos13
1383786560814909952,"@usuario Necesitamos mas muertes, por ello debemos arreciar las sanciones y bloqueos al pueblo venezolano, ello nos garantizaría la toma del poder y la ayuda de los EEUU. !! VAMOS BIEN ¡¡ url"
1167647502721590016,"@usuario Desafortunadamente, nuestras leyes no son tan estrictas como en los Estados Unidos para las visas de inmigrantes."
1312728755123739904,@usuario @usuario @usuario @usuario @usuario Hay que terner poco cuestionamiento para ser migrante y votar por un antimigrante emoji señal de aprobación con la mano tono de piel claro medio emoji ojalá no seas venezolano porque ahí si que te odiará este tipo
1133154445922119936,@usuario @usuario @usuario Este sujeto ¿en qué situación migratoria se encuentra ? ¿trabaja en el gobierno ? Y si es así ¿Eso no es quitarle trabajo a un mexicano ?
1360634046980780032,"@usuario @usuario @usuario Y ya empiezan a decir idioteces algunos como tú, por un sólo caso no puedes generalizar, así como no te gustaría que por unos descuartizadores venezolanos en Perú, pensemos que todos ustedes son iguales."
1332388843392290048,@usuario @usuario @usuario @usuario denuncia funcionarios de la cancilleria están cobrando para dar fraudulentamente visas a Venezolanos sin revisar antecedentes penales pobre Ecuador lleno de corrupción @usuario
1143133312900300032,"@usuario BUENAS NOTICIAS!! Los venezolanos en la frontera norte pudieron pasar, gracias a tu presidente y tu flamante alta comisionada para los derechos humanos. Te informo que van a enterar mucho mas venezolanos emoji cara llorando de risa emoji emoji cara llorando de risa emoji"
1128866762584400000,@usuario @usuario Déjenla pasar..Déjenla pasar..POR LA FRONTERA SUR.
1285021974989890048,"Se disculpa por los ofensivos calificativos a los migrantes. Cuando te disculparas con nuestro pueblo @usuario por apoyar a nuestros hambreadores, torturadores y asesinos? Que han destrozado millones de vidas y familias? Tan inocente eres? Q no ves la realidad?"
1178149702015089920,@usuario Venezuela es un país de inmigrantes yo misma tengo un familiar casado con peruano. Esa es una pobre vieja ignorante que cree que se la está comiendo y de dónde cree que salió Tarek saab y el salami?.. y el burro de la barragana?..
1135255152062080000,@usuario El muro tendra puertas. Puertas por las que pasaran los migrantes LEGALES que cumplan los PROCESOS que SOBERANAMENTE establezcan los Estados Unidos.
1219385790402269952,@usuario @usuario Por que atacan los migrantes a los de la guardia nacional ??
1197891774074769920,@usuario Pediré los planos a @usuario y construiré un muro en nuestra frontera.
1210227964576709888,@usuario Y después simplemente se unen a la caravana migrante y alegan que en su país no hay forma de salir adelante y buscan el sueño americano o se plantan en otro país y siguen sangrando el sistema.
1390860307233390080,"@usuario Cuál millón de Venezolanos, aquí no hay esa cantidad de venezolanos es algún momento hubo 400 mil y quedan muchos menos de 100 mil.."
1135622198842989952,@usuario ya empieza a trabajar con tu política exterior y reglas migratorias que todo país tiene !! No es posible las consecuencias que se pueden venir macroeconómica y tú no eres para ir a usa !
1266548467897380096,"@usuario Sr Pte necesitamos urgente refuerzo militar policial acá n PJC..para control estricto xq ya no se respeta el cierre d la frontera..demasiada gente pasa,mismo con el supuesto control militar.. emoji cara agotada emoji"
1373748047012900096,"Esto es CRITICO @usuario @usuario @usuario @usuario a cuidar fronteras con hashtag brasil Se nos viene una tercera ola @usuario si no cierran frontera con Brasil, nadie puede venir de ahí.."
1340787761847160064,@usuario ¿? ¿Y usted ya olvidó cuando abrió puertas de Chile de par en par permitiendo una inmigración irresponsable y desatada? Todo el caos en consultorios y cupos para escuelas es responsabilidad suya y de Bachelet.
1328836246253289984,El gobierno dirá que esa era la estrategia: estrangular al pueblo para que los migrantes envíen más dinero Las Nuevas Ideas para estorsionar!
1142867398023879936,"@usuario La verdad es q la sociedad cada vez está más agresiva y muchas veces creo q es llevada por la impotencia de ver como una clase en Chile vive en completa impunidad y privilegios, y eso los lleva a ser agresivo con otras personas, de acuerdo con hay q filtrar la migración, salu2"
1191770904906240000,@usuario @usuario Unidad Nacional? Si es un monstruo que ha polarizado y divido al país entero!! Apoyo para que convierta a México en Venezuela ? Ud esta igual de loco ! Váyanse porque esto no acaba hasta que se acaba
1148117404016400000,@usuario Pienso que Trump no está en contra de la inmigración. Que está en contra de la inmigración sin control e ilegal.
1244820553418129920,"@usuario @usuario @usuario @usuario @usuario @usuario Perú, Perú, Perú..Libre e Independiente gracias a la única Batalla ganada por el *Venezolano* General en Jefe Simon Bolivar en Ayacucho..! Nosotros Venceremos.!"
1186828519361440000,"@usuario Qué mayoría, a la que se le encuestó sobre el aeropuerto, sobre regalar millones a Centroamérica, o quizá los que están a favor de su millonarias sumas regaladas por la cancelación del aeropuerto, o de los inmigrantes con toda su ayuda que no da ni a su pueblo? Esos? Puff"
1159406593697570048,"Marcha ""anti migrantes"" este fin de semana en Santiasco? hashtag aweonaos"
1352242835261690112,"@usuario @usuario @usuario Los inmigrantes en chile en su mayoría tienen los trabajos que los chilenos no quieren hacer, estoy de acuerdo en que el estado debe regular más a quien deja entrar en el país, pero decir que por los extranjeros los chilenos no tienen trabajo es irreal."
1099754585651069952,@usuario @usuario estos serán más votos para que en el futuro no vuelva a salir un imbecil como tú. Son la comunidad de inmigrantes más grande de Chile y eso los tiene con cagadera
1368725092860100096,"@usuario @usuario Aquí en Colombia siempre les han dicho ""veneco"" al nacido en Venezuela, esa palabra quiere decir vénerea complicada."
1373822836784179968,¿Y los venezolanos porque migraron a Ecuador? ¿Por el genial gobierno de Maduro?
1132429818534989952,"@usuario Y no te dio rabia el genocidio ocurrido en Chile durante el Gobierno de @usuario en el que murieron más de 25.00 compatriotas por falta de atención médica, no sabes cuántos chilenos han muerto por no ser atendidos a tiempo. No estamos en condiciones de recibir inmigrantes"
1382710410730739968,"@usuario @usuario Es sorprendente la cantidad de personas brutas en el mundo, y lo peor es que gracias a la globalización a casi no existe la supervivencia del más capaz. Como puede alguien, que vive a diario entre MILLONES de venezolanos, querer un modelo similar al de Venezuela?"
1344288396223660032,"@usuario La culpa no es de los inmigrantes, es el sistema público rasca, ineficiente y que a los Gobiernos les importa emoji champiñón emoji emoji champiñón emoji"
1387479099900420096,Una pregunta: ¿Es ético permitir la migración irregular de ciudadanos de un Estado a otro; tal como los haitianos a RD. hashtag comite vigilancia migratoria hashtag no invasion haitiana rd hashtag canciller rdrenuncia ya url
1116557477166800000,"@usuario Están llegando muchos inmigrantes, se necesita un programa de vacunación específico, pues en general muchas enfermedades ya fueron erradicadas en Brasil porque tenemos un sistema de vacunación desde la niñez, ¡pero en algunos países esto no pasa!"
1281575871690800128,Se me olvidaba k los inmigrantes no son personas son hayawanat url
1181630120001440000,"No hay dudas que los eventos en el Ecuador son provocados por elementos conectados con el gobierno de Maduro. Algo similar puede decirse de la ""xenofobia"" contra venezolanos en Perú. Todo es un plan de la dictadura venezolana para desestabilizar a las democracias en América, .."
1135568752530140032,"No me vengan con doble moral, nosotros tratamos peor a los inmigrantes que cruzaron hace unos meses."
1282000852551699968,"Cierre de frontera!! Gritan algunos. No cierran pero si hace algo bueno que es obligar al uso de mascarilla. Pero que dices? Eso como va a ser? Exijo que me la paguéis.. Así pues con todo, menos mal que está vez les toca a otros probar de su propia medicina."
1232121577396940032,@usuario El lío es q en los 90 dejaron de impulsar casas baratas xq la población caía. El boom económico aumento inmigración y hoy falta vivienda en todas partes. La ley nueva no aplica a casas construidas después del 2014
1267874820064189952,"Cuando dejas entrar de forma masiva inmigración de culturas tan diferentes, estas poniendo la semilla para que antes o después tengamos estos problemas sociales, como lo de hoy en el Aldi de Gerona."
1150373026619369984,"@usuario Pero cuando digo que la migración es un negocio capitalista y no un derecho humano me caen encima, allí tienen, a quien le conviene la migración? es o no un negocio? quien me dice lo contrario?"
1164379070311909888,@usuario @usuario @usuario Sigues pobre migrante
1139225542299980032,"@usuario No estoy de acuerdo con la natalidad irresponsable, pero esta gente no tiene ni para comprar un preservativo, los programas de control de natalidad deben ser prioridad en este proceso migratorio y aplicarse a la Población colombiana. @usuario"
1199161614362190080,"@usuario No faltan pretextos para intervención militar: Multi caravanas de migrantes nunca antes vistas, Culiacán caso insuficientemente aclarado en sus orígenes, masacre de mujeres y niños mormones originarios de Utah..etc. ¿qué falta?"
1117346160467949952,"@usuario @usuario Mientras el trabaje para los Centroamericanos!! El pais no va ir para un solo lado? Muchos estan molestos por tanta ayuda a los Centroamericanos, y con el pacto migratorio? Que no le dice al Mexicano todo lo que trae? El pacto migratorio!!"
1268339150727539968,@usuario @usuario Tu eres una de las que salió a rebuznar que los haitianos trajeron lepra. Quédate calladita no más porque eres una inmigrante de 2 generación sus padres llegaron cagados de hambre y ahora insultan a los nuevos migrantes por querer lo mismo que el estado le regalo a sus padres..
1197725597511879936,"@usuario Semir presidente. Tique de queda, militaruze la ciudad, cierre fronteras. Y hay que controlar los medios, algunos cse pasan. No hay que bajar la guardia."
1159473027500979968,"@usuario Resentido? Lo diras por los inmigrantes, a mi me da absolutamente lo mismo que ellos puedan tener casa o celulares. No soy como otros que critican hasta eso ""si los chilenos no tienen celulares ellos tampoco pueden tener"" emoji cara revolviéndose de la risa emoji emoji cara revolviéndose de la risa emoji Paz no mas emoji pulgar hacia arriba emoji"
1141836156272860032,"@usuario @usuario En otros países ni siquiera es gratis estudiar , por eso hay tantos inmigrantes acá, ya eso es mucho que puedan estudiar y recibirse de lo que cada uno quiere, me parece excesivo además pedir que te den fotocopias o te alimenten, como dice los presos viven ahí lamentablemente"
1175196170211269888,Asi mismo es aunque los paramilitares estan en Venezuela desde hace tiempo han invadido territorio y creado hasta urbanizaciones a las que le han puesto nombres de barrios colombianos como por ejemplo Buena Ventura
1143878384424039936,"@usuario Además, así los países se libran de llenarse de inmigrantes solo porque no piden nada . Si es un problema de Venezuela que afecta la región no debe ser un solo país el que cargue con todo, y en ese caso protege su nación con visado."
1329108895793639936,"@usuario @usuario @usuario Maduro lo hubiera recibido con honores, seguramente esa es la misión que les encomendó a los presos que liberó y llegaron a Colombia como refugiados"
1394444227464019968,"@usuario El gobierno es una puta caca , pero tú eres un deficiente, puto pelo cordero !! Me tienes hasta la polla !! En Avila no hay más que cagao de turismo , y triperos explotando a chavales e inmigrantes en la hosteleria, dónde está la industria ?? TROZO MIERDA !!"
1222535825835089920,"@usuario @usuario @usuario Bueno, sí, estamos pagando el muro, pero vamos a hacer un muro en la frontera con Guatemala y los Guatemaltecos tendrán que pagarlo"
1192110911948869888,"Primero la revocación de mandato en 2022.. así se tiene un margen para seguir ""maiceando"": beca de ninis, regalar dinero en nombre de López, 5 mil pesos de ayuda a migrantes.. Con la finalidad de tener su ejército de votantes listo para las elecciones Además.."
1285612550550439936,@usuario Asentamientos conformados por migrantes trabajadores son muy apreciados..pero cuando no es así..ue pasa? Cuando lo que llega a un país no es la calidad de la migración esperada..que sucede?
1108108115202009984,Por eso Trump pone trabas a la migración latina
1184139525745969920,"¡Santiago! Mientras tanto, sin tren de uso diario entre Concepción y Puerto Montt y Valdivia. Centralismo sin control. Ya viene la migración que cambiará a Chile."
1230836872882129920,"@usuario Debemos aprender a convivir, ya Colombia y Venezuela prácticamente es un solo país, con una frontera libre y sin control alguno con los migrantes venezolanos."
1174840503461989888,@usuario @usuario @usuario ¿Existe alguna Ley que prohiba embarcar a todos los venezolanos que estàn ingresando a Colombia y enviàrselos a los países que simpatizan con Maduro?
1391743445321100032,Con que derecho un inmigrante hace eso en un pais ageno?
1144790959789609984,Me pregunto algo emoji cara pensativa emoji viendo la crisis de migrantes centroamericanos y venezolanos ¿por qué se critica más duramente a los países que no quieren recibirlos en vez del país que los esta obligando a emigrar de manera desesperada?
1134306166505389952,"@usuario @usuario Es simple, parar los migrantes antes de llegar a México o siquiera mostrar la intención de hacerlo."
1354085777374919936,"@usuario no puede ser el descontrol de ingreso de venezolanos por tumbes, por favor, presidente del Perú que está pasando en tumbes??"
1354891291453220096,"Entonces se vinieron los venezolanos que estaban en argentina, ecuador, Peru. Estamos mucho peor de lo que pensábamos. hashtag holachilelared"
1115943574204370048,"@usuario A Bachelet, le espera un juicio, por alta traición a la Patria, por ser autora del ingreso ilegal de miles de migrantes con falsa visa de turismo.Mujer falsa inepta y nefasta."
1242159439618109952,@usuario jaja q hijoeputas son los colombianos jaja y hablan paja de venezuela
1140344443465330048,"@usuario Pues si, se le olvidó de que mucho venezolano que se fue para allá es descendiente de colombiano. Y parieron que jode en Venezuela, solo que el problema se les devuelve."
1381950826462249984,"@usuario @usuario Inmigrantes, mano mas barata?, obvio, si ni un chileno con tanto bono de mierda quiere mover el poto, y los que llegan quieren trabajar y partir.. No dijo ni una mentira..recuerdas cuando el comentario era ""prefiero una nana P.."" ahora, esto de la mano más barata se da en emoji globo terráqueo mostrando asia y australia emoji"
1152800270222579968,@usuario @usuario @usuario @usuario Es fácil cuando la balanza favorece al sector económico empresas en gral. ..que es del chileno?? Se acuerdan que muchos somos inmigrantes en nuestro propio país..
1312559516085609984,Los logros de la izquierda desde el 18O: Cesantía Quiebras Violencia Saqueos Odio Intolerancia Más migrantes Más pobreza Más desesperanza hashtag rechazo tu tongo
1157158805542599936,@usuario @usuario como estamos en austeridad seguramente les dara tortillas sin sal. Por que esta ahorrando para unos estadios de beisbol y darle mas dinero a los migrantes
1170838225742720000,"@usuario DON GILBERTO NO AL PACTO MIGRATORIO , NO ES RASISMO. ESQUE MEXICO TAMBIEN TIENE SUS PROPIOS PROBLEMAS"
1359496410597590016,@usuario Ponte que un inmigrante ilegal llega a Santiago con 50$. ¿Donde puede residir con esa cantidad de dinero? ¿Puede conseguir trabajo rápidamente para ser autosustentanble? ¿La oferta laboral disminuida por la pandemia no defradara sus expectativas? Y en ese contexto q viene?
1195799707186080000,@usuario @usuario @usuario @usuario @usuario @usuario Hoy López tiene la guadia nacional casando migrantes y sin dar seguridad a los Mexicanos url
1358250094399810048,@usuario En vez de sacarlos cada día se la ponen más vacana aquí en Colombia..q se largue a su país a sacar al dictador y a exigir allá..fuera VENECOS!!
1375165607654619904,@usuario supongo que a los que entran de forma ilegal tambien los haran hacer la cuarentena pagando los 300 mil de la residencia sanitaria al igual que los llegan de brasil hashtag aeropuerto
1237396150581370112,"ESO LO HA HECHO TODA LA VIDA""HERMANA"" REPUBLICA DE COLOMBIA CON VENEZUELA: LEGALIZAN VEHICULOS, ALIMENTOS, SUELTAN PRIVADOS DE LIBERTAD X SOBRE POBLACION PENAL Y LOS HACEN HUIR A VENEZUELA, COLOMBIANOS CON DOBLE NACIONALIDAD, DOMICILIADOS ALLA Y PAREN EN VENEZUELA, GASOLINA..CDM"
1084613070989740032,"@usuario ¿de los mios? no,gracias,con lo que hacen los migrantes hondureños y salvadoreños en mi estado,tengo,para que un ignorante como tú,quiera hacerse el héroe."
1153124121703849984,@usuario Oye cuéntanos un poco.. es buen negocio esto del tráfico de inmigrantes?? quiero meterme en este asunto.. necesito plata.
1157545985683450112,@usuario Hay que hacer responsables a los que permiten y viven de la inmigración ilegal. Estas violaciones son evitables.
1121794339187779968,"C. Pres. @usuario , llevamos más de 30 años sin crecimiento económico y mucha pobreza en México, hoy es momento de cambiar esto dando trabajo a nuestro pueblo en todo el país y evitar que nuestros migrantes se vayan al extranjero. ¡PRIMERO MI PUEBLO ANTE TODO!"
1177764160651889920,"@usuario @usuario No hay odio, la inseguridad era un gran problema antes de la llegada de venezolanos al Perú. Los índices de criminalidad han aumentado con su llegada y eso esta siendo aprovechado por grupos políticos radicales tanto de derecha cómo de izquierda."
1087640666308569984,"@usuario Esta es la criminal inmigración de Bachelet, tan defendida por la izquierda. Y es lo que la ONU está haciendo contra todos los países que firmaron el pacto migratorio. La inescrupulosa Alta Comisionada es cómplice de los delitos cometidos por estos delincuentes."
1198834397920849920,"@usuario @usuario @usuario @usuario La ley de inmigración de 1975 tenía la orientación para prevenir eso, pero se ha orquestado todo un sistema para eludirla y traer mucha más gente de la que Chile podía aguantar."
1225068326897979904,"@usuario @usuario @usuario @usuario @usuario Mi solidaridad y apoyo a los venezolanos honestos y trabajadores q llegaron a Perú buscando oportunidades. Abrazos!! Es lamentable, pero buen número vinieron a delinquir y ellos los hacen quedar mal. Lo q genera desconfianza hasta en los empresarios para poder contrartarlos"
1178182687078720000,"@usuario Peruanos ¡Abran los Ojos! La llegada de venezolanos les ha traído más beneficios, pagan sus tasas de los trámites consulares, sirven con calidad, gastan más dinero en Perú que lo que envían a Venezuela, personal calificado y preparado sin invertir ni un centavo. ¿Sigo?"
1179430074703079936,"Señora Sara, confunde migración con delincuencia. Ser migrante no es ser delincuente. Como ser nacional no lo inhibe de ser delincuente. Acá a Chile llegan delincuentes como llegan a Europa chilenos delincuentes, que son delincuentes, pero no por ser migrantes chilenos."
1091048480875920000,"@usuario Lamento que no haya ningún urbanista con visión, solo personas que seguirán confundidos, dándole más cabida a los migrantes del interior, que ocupan más servicios de energía y agua, pero si voto es lo más importante, y el desarrollo de los departamentos donde?"
1225979095999219968,"@usuario antes de que vengan venezolanos ya hay mucho desempleo en Perú, así que es imposible que todos los venezolanos que llegan a Perú tengan trabajo estable eso es imposible porque no lo hay, tercero si quieren retornar es su decisión, solo que no tiene lógica.."
1326639271328029952,@usuario @usuario @usuario Nos avisas que te dice cuando se ponga peor por no cerrar fronteras otra vez. Pinche títere
1175920262799419904,"El problema nunca fue la migración de venezolanos. El verdadero problema es siempre ha sido el Perú en general, su informalidad, malas gestiones, CERO PRODUCTIVIDAD Y EMPATÍA. El tipo de gente de mierda que tenemos en cargos importantes es lo que no nos deja avanzar."
1120363943749459968,"solo en el área de la salud, creo que en total superan los 40.00 despidos, súmenle a eso la migración de más de 200.00 extranjeros sin trabajo fijo, y todavía se preguntan porque aumento la delincuencia ?"
1357140402365730048,Esto es impresentable.. Beneficios a inmigrantes.. Educación superior gratuita para todos.. Aborto libre y gratis..y un largo etc. cuando tenemos problemas como éste
1124349118665629952,"¡Ajá!, ¿Entonces los migrantes venezolanos o son víctimas o son ejército infiltrado del ""socialismo del siglo XXI? Escoge una de dos @usuario.. ambas no se puede. hashtag ordonez hashtag titere sin control del gobierno"
1343003529984829952,"El momento de cerrar fronteras fue este verano. O hace un mes. Ahora es demasiado tarde para mayoría de países. 2. Si los países tuvieron dificultades para detenerlo antes, ahora lo tendrán mucho más difícil. Si es un 60% más infeccioso, R0 ha pasado de 2,7 a 4,3 en promedio."
1364119389176560128,@usuario Aceptación de inmigración ilegal POR COJONES
1156941650968669952,"@usuario @usuario Sí. Una crisis que él y su gobierno crearon al literalmente invitar a los migrantes y hasta ofrecerles visas de trabajo. Nunca en la época moderna, y quizás ni en la antigua de la historia de México, existió un presidente que se humillara más ante EEUU. Es el gato de Trump."
1089967320087389952,@usuario @usuario @usuario @usuario Mas raro me parece que Macri dijo que hay que echar a los inmigrantes ladrones y su padre siga en el país
1299697046635660032,@usuario Vente a vivir a Chile entonces. Acá te esperan todos los pobres inmigrantes que trajiste en hordas y les mentiste. Ven a vivir en campamentos como ellos. Vieja cínica mentirosa y cobarde . hashtag rechazo emoji bandera chile emoji
1368475232789390080,"@usuario @usuario Gobierno Comunista. Jjaja jaja Resulta que miles de venezolanos en 2020, incluido el líder de la oposición Leopoldo López, encarcelado por el comunismo, son gilipollas y huyen de su país comunista para pedir asilo político en otro país comunista jojojo no se puede ser más bobo"
