id,text
1110927215800280064,"@usuario ¿Por que debería entrometerse México por lo que construya Estado Unidos dentro de su territorio? Se queja la clase alta y burla de migrantes y pero aprueban la migración ilegal por pobreza! Y desaprueban medidas para disminuirla, Mediocres son lo que tienen esa incongruente idea!"
1317855110345750016,"La situacion en Republica Dominicana es critica, y las agendas LGBT y migratoria, pretenden terminar con el pais, gracias a una invasion fusion y una serie de metodos que atentan contra lo mas intrinsico de los dominicanos, sus estudiantes, y ese mal es la Ideologia de Genero."
1159193141439879936,"@usuario @usuario @usuario Ya que te gusta informarte te dejo un par de artículos que podrían interesarte: url y url. Aparte Chile no es la panacea de los servicios públicos como para que los inmigrantes queramos venir a ""robar"" salud y educación, créeme! emoji cara con ojos en blanco emoji"
1313631391490490112,"@usuario @usuario Lamentablemente este Gobierno termino de entregar el País en bandeja . Estamos hasta el perno. Inmigración ilegal, delincuencia, narcotrafico, lumpen, etc etc , no hay control ni orden y cada día será peor ."
1195829217294010112,"@usuario @usuario @usuario @usuario @usuario Creo que cerrar las fronteras es urgente, ya en Colombia no cabe uno más"
1206615090079980032,"CON LA POLÍTICA DE FRONTERAS ABIERTAS Y SIN CONTROL, MARTÍN VIZCARRA PERMITIRÍA QUE ESTOS MALOS ELEMENTOS YA ESTÉN EN EL PERÚ PARA OCASIONAR DISTURBIOS A FAVOR DE LA DICTADURA DE GÉNERO. ¡ ABAJO LA DICTADURA DE GÉNERO ! hashtag defensa ciudadana url"
1370048597094510080,@usuario Es una realidad social ya dejé de politizar ay qué tomar medidas contundentes con los venezolanos que es una realidad muchos vienen a delinquir y no se puede seguir romantizando la delincuencia
1332152519972320000,@usuario @usuario Pero no fueron culo de encontrar un culpable de las quemas de estaciones de metro.. Y ni hablar de la pasarela de inmigrantes que hay en el norte.. Pura basura.
1252636233274210048,@usuario Boy Me sorprendió que el mundo se acabe y sigan las deportaciones de inmigrantes kk vei Sdds qnd disparó al presidente ..
1183846312384570112,"No soy xenófobo ni nada, pero perder ante los inmigrantes es triste por decir lo menos."
1139949698490329984,"@usuario @usuario El principal responsable del caos migratorio, él omitió la ley y permitió el ingreso irregular de miles de extranjeros, se le debe de aplicar la ley de responsabilidades por tanta omisión y @usuario deben ser objetiva y levantar las recomendaciones por las muertes en la estaciones"
1175094799671680000,"""A diferencia del delincuente peruano que tal vez muestran un ápice de remordimiento de culpa, el delincuente venezolano no tiene esa característica, es sumamente frío y no tiene remordimiento"" A eso se exponen los gobiernos latinoamericanos dejando a Maduro continuar en el poder"
1305968929433679872,"@usuario @usuario @usuario JAJAJAJAJAJA ""no soy xenófobo porque defiendo la inmigración"" JAJAJAJAJAJA Pues ve con cuidado,porque te identificas mucho con los enfermos nacionalistas"
1084230715804390016,"@usuario @usuario No tendríamos q ofrecer ese tipo de trato es un bien común una problema menos de migración ,narcotráfico, y peligro eminente de individuos no deseados a su país a sus terroristas del medio oriente emoji cara sonriendo con gafas de sol emoji"
1239874124148869888,"@usuario @usuario Que triste con esta gente ignorante, egoístas. Sólo piensan en su bienestar. No se que tienen en la cabeza. Autoridades que les apliquen el peso de la ley. Señores policías protejanse aparece uno sin mascarillas."
1357743593885210112,"@usuario @usuario Y la gente sinceramente se canso de la inmigracion ilegal, no hay trabajo en chile como para tanta gente!!"
1297939946498660096,"Bloquear, prohibir, finalizar. Todo muy Siglo XX. El pato anda reduciendo la política migratoria al juego de Policías y ladrones. Será que sin estigmatización no se puede administrar ese país?"
1238924822819770112,Qué espera @usuario para hacer los mismo ? Cierre de fronteras y no recibir vuelos internacionales !! hashtag alerta coronavirus
1153265335396699904,Esos Ediles que Protegen y tienen los RICOS como a la Mattei y Lavin que no conocen de Necesidades ni de Pobreza y siempre se han movido en Barrio Alto que le van a INTERESAR LOS INMIGRANTES ni los CESANTES
1378798436330390016,Gracias ⁦@usuario⁩ por tus inmigrantes ahora somos un país más seguro emoji cara con símbolos en la boca emoji url
1348485232610040064,@usuario De ahí la importancia de cerrar fronteras..!! Por este personaje ahora en nuestro territorio habrá otro miedo más 🤷 emoji tono de piel claro emoji ‍🤷 emoji tono de piel claro emoji ‍
1198421754479330048,"@usuario El oasis puede ser para los esforzados y q aman sus país con sus defectos y virtudes , pregúntenle a un peruano ,venezolano, vienen a trabajar y tienen muchos sus propios negocios y el chileno medio nada? Si los problemas en salud y previsión el modelo no es malo se puede mejorar"
1362126517308969984,@usuario @usuario @usuario @usuario La realidad es que en la práctica al entrar como turistas y luego conseguir un contrato están burlando la ley. Falta además un política pública que aclare cuantos migrantes soporta el sistema de salud y otros de apoyo social a los chilenos más vulnerables
1083158726041849984,@usuario clei1ton ¿Quién habló de negarse? Simplemente abandonó el pacto para que el país elabore sus propias reglas de recepción de inmigrantes. ¿O cree que las políticas (que ni siquiera tienen en el vdd) para dar la bienvenida a los venezolanos son correctas? No es bueno para ellos ni para nosotros.
1142472537940460032,"@usuario Puede que la mayoría de los migrantes sean inocentes en México, pero no todos lo son y muchos son delincuentes que huyen de la justicia de sus países"
1253926002184640000,"@usuario @usuario @usuario ACÁ NUNCA SE SELECCIONÓ LA INMIGRACIÓN, FUE UN TERRIBLE ERROR. ACTUALMENTE CON DÉFICIT HABITACIONAL Y DESOCUPACIÓN SEGUIMOS CON FRONTERAS ABIERTAS. LOS PAÍSES NORMALES SI NO TENÉS UN PEQUEÑO CAPITAL O ESTUDIOS ÚTILES PARA EL PAÍS DE ACOGIDA NO ENTRÁS."
1134462884841479936,"@usuario Una economía justa y leyes de inmigración justas entre los países es lo que pides, una posición de ganar ganar; porqué resistirse a esto? porqué hay que aceptar que unos tienen derecho a entrar ilegalmente y otros deben hacerlo en forma legal en USA"
1161090799465129984,"@usuario @usuario @usuario @usuario Es que es imposible que sean miles de millones, si aun fueran el triple los migrantes su poder de compra es bajo como para generar daño a la economia de chile."
1291757234536560128,@usuario Al millon de venezolanos en Perú : ¿ por qué tenemos que pedirles visa?
1154193927999800064,"@usuario Los Democratas y la prensa amarilla (Univision, CÑÑ, CBS) se la han pasado bajo Obama festejando a todo homosexual que salía del closet, su personaje favorito es un inmigrante ilegal transexual que quiere adoptar un niño. Trump no esta esta en contra pero es normal y moral."
1236816379963209984,"@usuario El termino veneco lo utilizaron los colombianos hace los mismos colombianos q se la echaban de venezolazos, nada q ver con todo . Como en toda parte del mundo, cuando hay inmigracion extranjera llega gente de todo tipo, la xenofobia es el peor mal del ser humano"
1150369360516530048,"@usuario @usuario @usuario @usuario El pase reglamentado se obtiene con promedio, en cada carrera es diferente, bendita universidad q preferir a sus alumnos antes que los externos. Imagina apoyar a un migrante por encima de un ciudadano mexicano que está muriendo de hambre o regalar dinero a un país ooh espera! url"
1164162545407729920,@usuario @usuario Grande EEUU. le da papaya hasta a un inmigrante ilegal para que critique el sistema que le dió oportunidades. Con razón se emberracan a ratos.
1322514029487759872,@usuario Colombia no puede venirsela ahora a tirar de poner restricciones a migrantes cuando toda la vida su gente a migrado a otros países por la perra necesidad..nos toca pagar ese precio y quedarnos calladitos..el pez muere por su boca.
1294951059245469952,"@usuario ¡La realidad les guste o no!,en los 70 el venezolano era ""Pobre,pero HONRADO.""(ahora lo llaman pendejo) llego una inmigracion LatAm caribeña con muchos ""vicios"",al ""integrarse""con el venezolano,cambio para mal la idiosincrasia del venezolano,muy diferente a la inmigracion europea"
1359910774186129920,"@usuario @usuario Cuando no se ve el contexto, se habla sin saber, a ese pueblo fronterizo de 300 habitantes llegaron 1500 inmigrantes indocumentados, los lugareños fueron víctimas de robó y abusos, y como recita la biblia: ""justos por pecadores"""
1369661227530619904,@usuario hashtag stopsb101.hashtag protect ncfamilies @usuario Necesitamos parar todos estos proyectos de leyes anti inmigrantes que afectarían y perjudicarían bastante a nuestras comunidades inmigrantes trabajadoras.
1292189558117890048,"Todos los que amenazan con irse del país váyanse por favor se los pido, sin llorar y sin pedir que los traigan de vuelta después eh emoji símbolo de mareo emoji"
1158084744959209984,"@usuario @usuario @usuario Oye flaca, hasta en un episodio del programa del Pancho Savedra, contra viento y marea, un Haitiano admtió que Bachelet hizo un tipo de pacto con Haiti para permitir el flujo de migrantes entre ambos paises sin necesidad de papeles ni visa emoji cara con ojos en blanco emoji url Minuto 1:18"
1091406010185639936,El chorro se llevó un celular de 20 lucas. Lo vende a 10 en el mercado negro y sólo paga 700 x el delito. Sigue siendo un negoción. Para colmo lo obligan a regularizar su situación migratoria regalandole el DNI. Somos el hazme reír del mundo.. hashtag buen viernes
1210268467368219904,"@usuario Le creo,la situación es de cuidado con los migrantes emoji cara radiante con ojos sonrientes emoji emoji cara revolviéndose de la risa emoji emoji cara neutral emoji"
1211168930301169920,@usuario Estadísticamente tienes alguna prueba para criticar la cantidad de extranjeros trabajando ? Sabes si tienen estatus legal o ilegal ? Cuidado y te sorprenderás que cada inmigrante que veas y jusquez este legal. Sencillo doña ellos solo trabajan.
1142441747047430016,"@usuario Eso de que ""Venezuela abrió las puertas a los inmigrantes"" es bullshit, alguien dejo la puerta abierta y ningún gobierno hizo algo al respecto"
1239626498769850112,"Cerrar frontera con Venezuela pero dejar la frontera con Ecuador abierta, es como limpiar la casa por un área solamente y no limpiar el resto de polvo que se acumula."
1366129685034340096,hashtag ultimo minuto mano la historia esta escrita fue un venezolano el que lideró colombia y fue un colombiano el que traicionó a ese venezolano entonces? que podemos esperar es su naturaleza llevan la traición en la sangre no esperen nada a cambio de ellos
1318915518556930048,"Normal, pero con las cagadas que se mando en su gobierno con los inmigrantes, imposible tener esos accesos, ""me imagino que sabrá porque"" y deje de hablar tanta estupidez."
1322236662731190016,"@usuario @usuario @usuario Andrés,yo no solo tengo amigos sino familares Venezolanos que vinieron a trabajar con pundonor,ética y moral,pero la referencia de doña Claudia,no va dirigida a ellos,sino a quienes vinieron a delinquir. Viví 10 años en Venezuela y pedía q colombiano criminal lo deportarán."
1245237601667330048,@usuario @usuario Se pudo haber echo más si no fuera por la negligencia de la marioneta Duque .tardo mucho en cerrar aeropuertos y fronteras .igualito de bruto al taita.
1246856549546560000,@usuario Guaido póngase los pantalones y saqué un pelo de dinero q manda EEUU y mandé a buscar a Miles de venezolanos que están en frontera para regresar a su estado
1378837212247310080,"@usuario @usuario No he visto ni un solo venezolano raquítico, desnutrido, de los que están de mendigos en las calles de las ciudades de Ecuador. Entre los venezolanos que permanecen en su país y muestran los canales de televisión, entre ellas la CNN, tampoco se ve personas mal alimentadas."
1156085140101189888,"@usuario no es su calidad de inmigrante, sino las repercusiones de inmigración masiva"
1160226523514840064,"@usuario @usuario Bueno, que tiene que haber controles, siempre. Pero eso no se puede cambiar por menos inmigración. Hay que reducir drásticamente la inmigración. Ya no somos la Argentina de hace 100 años. Este país tiene demasiada pobreza y desempleo; no necesita que le manden más."
1324948460974569984,"@usuario Que pida los datos personales de los inmigrantes que han dejado entrar al país, así pueden hacer un catastro de cuántos chilenos van a quedar sin fuente laboral."
1330674267458060032,"@usuario Con suerte el 10% de esa gente son Chilenos, el resto puros inmigrantes q seguro entraron ilegal gracias a tu @usuario y q @usuario INCREMENTÓ y se pasó por el otro la LEY VIGENTE DE INMIGRACIÓN DE 1975. Sino ningún ilegal hubiese podido entrar. Wn LADRÓN Y MENTIROSO"
1134468517577859968,se los dijimos AMLO ES UN PELIGRO PARA MÉXICO pero mucho mas para el mismo ABRIR LA FRONTERA FUE UNA DECISIÓN DE UN SOCIOPATA url
1241885565550820096,"@usuario y vienen mas casos como estos, pues esta gente viven del rebusque diario, la migración venezolana es una bomba de tiempo social y sanitaria"
1360556445222210048,"@usuario Y en cambio en Colombia los premian, regularizando su estado migratorio, a cambio de que?? De no aportar nada a Colombia, solo crimen? En cambio los venezolanos que sí están acá de forma legal, pagando impuestos y demás les toca endeudarse para regularizar su situación"
1156744426330500096,"Cómo dirían por ahí, si bien es cierto lo que dice el gobierno, no es menos cierto lo que dices Jorge. No es lo mismo 200 personas buscando empleo que 1200, el exceso de oferta además ha impactado en los salarios, hay que regular migracion, no es justo que ofrezcamos calle."
1322197536548019968,"@usuario Efectivamente, Bogotá no era una utopía y difícilmente lo será, pero si una persona migrante, comete un delito, debe ser condenada y deportada!"
1144996099054339968,CHILE SOBREPASADO POR INMIGRACIÓN ILEGAL
1086850933890400000,"La mata da de todo, por uno pagan todos, y lamentablemente asi será, que se pida documentos en regla en la frontera norte para que los venezolanos puedan entrar al país, no tiene? Regrese por donde vino."
1084883621192829952,@usuario ¡¡Ni los migrantes se comportaron así!!
1242147644820150016,"@usuario @usuario Tiene razón irresponsable es la gente que sigue en las calles creyéndose los pijas, los cráneos del país, capital federal y el conurbano va a explotar de coronavirus porque se creen los pijas del mundo en muchos casos.. perfecto que cierre las fronteras y no deje entrar a nadie.."
1347207461942530048,"@usuario Pero si los tenemos al lado en una frontera extensa de miles de kilómetros, se meten por cualquier hueco! Además es mejor tenerlos contados, pasando por Migración. Pero en algún momento se tendrá que construir un muro, como USA hizo con México."
1333843287485139968,"Esa gente es antiderechos, antifeministas, antiniñez, antibosques, antimigrantes, antivacunas, antigente.. así no se puede. Espero que @usuario deje de darles cancha. hashtag basta de antiderechos, Paraguay. url"
1311745676150220032,@usuario La inmigración ilegal apoyada por sectores del apruebo
1136145954283740032,@usuario @usuario @usuario Siguen entrando caravanas de migrantes no le queda claro al gobierno qué hay qué frenar el flujo?
1147322299613440000,@usuario @usuario @usuario Cierre de frontera!!
1347891685083259904,"@usuario SE VA LA GENTE QUE TIENE PLATA Y ESTUDIO ,LES QUEDAN LOS PLANEROS Y LOS INMIGRANTES BOLIVIANOS ,SEAN FELICES EN ESE GRAN PAÍS JAJAJAJA"
1195451825513799936,"@usuario @usuario @usuario Si ciudadanos venezolanos, se encuentran con armas, dinero en efectivo, en medio de los manifestantes, y no son los migrantes, por si acaso, ¿que se debe hacer?"
1330930385492969984,"Si coloco lo que pienso y expreso de la situación con los venezolanos en Trinidad y Tobago me cierran la cuenta por racismo, xenofobia etcétera.. hashtag el que entendio entendio"
1184172098371150080,@usuario Mil razones y justificaciones para favorecer la inmigración desastrosamente descontrolada.
1159819592501519872,"@usuario @usuario Mi esposo es jefe de RRHH en una empresa y por más que trataron de priorizar a los chilenos, pasaba que el extranjero cumplía con horario, asistencia y trato con la gente, y los chilenos fallaban (en especial los jóvenes) creo que nuestro problema va más allá de los inmigrantes"
1086376714282909952,"@usuario Perdón y en que rubro trabajas??, porque legalmente eso no corresponde, hay un tope legal del 15% con excepción de profesionales de especialidades que en Chile escasean, por mi yo contrataría muchos más inmigrantes, pero la ley hoy sólo me permite tener un tope de 18.."
1090327909024320000,@usuario Porque no nos consultaste sobre abrír las fronteras norte y sur? Que estas pensando? No ves que tenemos tantos problemas que solucionar internos y nos arrimas más problemas? Eres el presidente de México o de Centroamerica?
1107084849855250048,"@usuario Hola, Hágale dibujos a sus opositores, para que entiendan que corren peligro de invasiones, por parte de las caravanas de inmigrantes. Es mejor evitar que lamentar. Ca"
1194719746668790016,"Inmigrantes irregulares o con antecedentes, inmediata PLR. hashtag acuerdoporlapaz"
1158725202001449984,"@usuario @usuario @usuario Todo el mundo sabe que ha Sido pésimo presidente de deterioro la seguridad, se acabó el empleo y el país está lleno de migrantes"
1092245908702540032,@usuario Los anti migración weviando con Venezuela..
1239231761420359936,@usuario Hay que cerrar las fronteras!!
1133371818251890048,@usuario y llegaron los defensores de los derechos de los pobres inmigrantes
1388946689910840064,@usuario Ahora no fue la reforma fiscal de Bachelet y los impuestos en siempre expansión que hicieron que chile ya no fuera la mejor opción para invertir.. ahora son los migrantes emoji cara sin expresión emoji
1139519388791580032,@usuario Pues si @usuario fue quien provocó la situación al dar puertas abiertas a migrantes como se le va a apoyar
1326718416028369920,"@usuario Cual es la deuda del Estado con los afrodescendientes? Este es un pais de inmigrantes, hay colectividades de todos los origenes Mañana vas a inventar deuda del estado con los asiaticos, y con los oceánicos, etc etc basta Vicky!! Inutil becada!!"
1097662735964390016,"Critican a @usuario por lo del muro, pero es su deber controlar el ingreso de personas a su pais, el no es culpable de que en Mexico perdure la narco guerra, ni de las dictaduras de Nicaragua y Venezuela o cualquier problematica que genere migracion ilegal a EEUU"
1178061597757070080,Colombia tratando de controlar la invasión venezolana url
1162340247071419904,Él inmigración colombia está feliz porque hay 600venezolanos trabajando y los colombianos sin empleo que porquería dé gobierno
1142151808141280000,"@usuario @usuario @usuario @usuario Un ejemplo claro son los migrantes haitianos que están en la frontera, ellos no andan estirando la mano, exigiendo comida ni delinquiendo, ellos se pusieron a trabajar y a adaptarse al nuevo país. Los centroamericanos todo lo contrario."
1186089549547610112,Venezolano que apoye las protestas en hashtag chile es chavista. Fin de comunicado url
1097281728933229952,@usuario Al menos mis referentes no hecharon a inmigrante no construyeron un muro no abusaron sexualmente de mujeres no estafaron y así puedo seguir mamita
1259469851271269888,"@usuario Y ahora estamos mas ligados que no sabemos quien es quien, yo hace unos mese hablaba con un cuñazo y hablé mald e los vecinos y resulta que el tipo es hijo de colombianos, y cómo el insepulto le dio cedula y nacionalidad a millones, no joda."
1161793155089540096,"@usuario @usuario @usuario No, el inmigrante viene a aportar y a crecer junto a nuestro país. Lo que hay que hacer es adaptar la inmigración al crecimiento económico del país: a menor crecimiento, menos inmigrantes.. y a más crecimiento, más inmigrantes."
1150929222829040000,@usuario @usuario @usuario Piñera está castigado x economía no por política migratoria .. acá ya se pasaron x cualquier lado migración y ahora se puso orden ..
1219433186981240064,"@usuario Señor Presidente, con todo respeto me dirijo a usted para pedirle que por favor haga algo al respecto con el tema de la migración de hondureños y salvadoreños que esta dando de que hablar en nuestro país, si trabajen o no traen problemas. No lo permita. Analicelo"
1354550690211879936,"Es un binomio. Sin mafia, apenas habría inmigración ilegal."
1381359374204029952,"@usuario ¿Y la ley mordaza que ustedes quieren imponer para que no hablemos mal de delincuentes, feministas, LGTB o migrantes?"
1190624046557390080,@usuario Que el señor presidente siga sin tomar decisiones sobre migracion venezolana y siga abrochando al pueblo con impuestos esperemos la reforma tributaria haber que sorpresa nos trae.
1220213387293949952,"@usuario @usuario @usuario ""Amigo migrante: si quieres respeto, empieza por darlo. Eso de quererte meter a la fuerza, tumbando la reja, o corriendo por el rio, es una falta de respeto a nosotros como país. El respeto al derecho ajeno es la paz. -Estados Unidos de América"""
1384912253959480064,LOS QUE CREEN QUE CASTILLO RESPETARÁ LAS INSTITUCIONES DEMOCRÁTICAS DEBERÍA APRENDER DE LA EXPERIENCIA DE VENEZUELA CON CHÁVEZ @usuario APENAS GANÓ LA ELECCIÓN CONVOCÓ UNA CONSTITUYENTE ILEGAL Y CORROMPIÓ A LAS FFAA HOY HAY 8 MILLONES DE VENEZOLANOS MENDIGOS EN EL MUNDO
1370160695329880064,@usuario VENECOS son los colombianos que querian ser Venezolanos emoji cara revolviéndose de la risa emoji emoji cara revolviéndose de la risa emoji estos colombianos perdieron la memoria emoji cara con ojos en blanco emoji me acuerdo q los hijos de colombianos nacidos en Venezuela eran los venecos o sea VENEZOLANOS-COLOMBIANOS emoji cara pensativa emoji emoji cara llorando de risa emoji emoji cara llorando de risa emoji
1175127551498439936,@usuario Esa la ocupan para protejer narcos con la excusa q son migrantes
1242596391177920000,"@usuario cuando hashtag mexico truene por favor cuide nuestras fronteras porque se van a venir para acá, están siendo totalmente irresponsables."
1276223081338609920,"@usuario La verdad que no los entiendo, son migrantes, se les ayuda, pero en su mente es como una obligación, por tanto, ni las gracias dan.. Creo que es que son todos así, arrogantes?"
1265260849863820032,Pasamos a ser la tierra del trabajo a ser la tierra de los chorros y asesinos.. de inmigrantes a delincuentes.. tristeza infinita. Mucha luz a su familia.
1136781930668669952,@usuario @usuario Tuviste que ir hasta DC y estar allá 3 o 4 días para que entendieras que eso es algo que siempre tiene que hacer el gob de México?? Cuidar la frontera evitando a toda costa que cruce gente indocumentada. En serio @usuario ??
1241243717689920000,"@usuario RecordNews3 Sí, Brasil tiene que dejar de ser &quot;la casa de la madre de Joana&quot;, no solo por eso, sino por muchas razones. Prohibir totalmente la entrada de extranjeros así como la salida de brasileños sería lo correcto en este momento."
1088110296852499968,@usuario @usuario DEBE SER POR AMLO QUE USA ESTA LLENO DE INMIGRANTES MEXICANOS
1191330114765769984,Quizás se den cuenta @usuario el daño que hace hashtag migración de hashtag venezuela a hashtag america lo creado hashtag violencia @usuario @usuario @usuario hashtag peru @usuario @usuario @usuario @usuario esto no es un juego es libertad y paz
1087386495412000000,"Lo que pasó en Ecuador fue producto de la inmigración sin regulación, cosa que nunca pasará en Chile ya que Piñera pensó primero en su país."
1087719099285859968,"@usuario La verdad, pienso que como la gente no empiece a informarse en serio de cuales son los males de nuestra sociedad y empiecen a darse cuenta de que están usando al inmigrante como chivo espiatorio, al final la historia se volverá a repetir en europa.. muerte y destrucción"
1151888570828909952,"@usuario Nuevo Peru?, van a refundar la Patria?, Van a cambiar la Constitución?, Van aplicar el socialismo del siglo 21?, se van a perpetuar en el poder?. Toda esta basura aplicaron en Venezuela y hoy tenemos problema regional de migracion."
1358787809046330112,"@usuario @usuario @usuario @usuario @usuario @usuario @usuario @usuario @usuario @usuario @usuario @usuario @usuario En los ultimos 10 años el 10 por ciento de la poblacion de Paraguay se radico en Argentina. Somos 50 millones, los sindicatos del estado, antes de la pandemia, no querian hacer el censo. Con una economia destruida recibis inmigrantes y no tenes vivienda ni trabajo para ellos."
1158065537051770112,"@usuario Alejandro y tu ers la Bea sanchez de la izquierda pero flojo, este gobierno esta con estos temas por que tu presidenta dejo la debacle y la sigue haciendo , gente como ella y como tu demuestra claramente que su administracion es un fracaso solo mirar, crec., endeuda%, migracion"
1143169443091980032,"@usuario Toda la razón!! No sé si es comparable la cantidad de migrantes de chilenos de antes, con los venezolanos de ahora."
1376171511665560064,"Este travieso &quot;BACURIM&quot; criticando al presidente porque el presidente no cerró las fronteras, este gusano fue uno de los responsables de la aprobación de la ley que prohíbe el cierre de fronteras y a favor de la inmigración de todo lo que no vale. !! ! url"
1314740379439239936,@usuario @usuario @usuario asu una veneca con bandera de ecuador y nombre de colombia viviendo en peru q original
