id,text
1131286328279229952,@usuario @usuario Porque ahora? Esto a ocurrido hace mucho tiempo? Lo pasa es que se quiere victimizar a inmigrantes y asi validar su llegada y privilegiar sus derechos.
1166902998930510080,"@usuario @usuario En este país todo lo que está al lado de la izquierda es intocable, desaparezca dinero, corrupción, droga, ingreso ilegal de inmigrantes, Sename, etc., no hay culpables. La administración del Estado necesita un cambio rotundo, partiendo por el Congreso y eliminar la agenda 2030."
1156576462876630016,"@usuario Don Marcelo y esos datos de donde los saca si ni siquiera tienen idea del@usuario en la@usuario sur . Por favor esa@usuario usted se la cree . Además. Quitar empleo en Mexico para crearlo en centro@usuario es una traicion al país , no lo cree ?"
1394692809307970048,"@usuario No los veo deambular ni mucho menos desnutridos como para seguir llamándolo ""crisis migratoria"""
1278697895923990016,"@usuario Interesante el programa de astronomia, pero de poco uso. Seria mejor dedicar el tiempo para el problema de inmigracion ilegal que prolifera en este condado, y donde hay muchos casos que los que escuchan a la Poderosa pueden hablar con experiencia propia."
1328890554114070016,@usuario @usuario @usuario @usuario Si todos los migrantes colombianos que llegaron a Venezuela tenían uriola y alitas.
1099137705747849984,"@usuario de la manera mas atenta ya es hora de que mande al ejército a la frontera sur, y no permitir que pase ningún indocumentado, y si los militares son agredidos, darles la orden de responder con gran fuerza, el respeto se gana Sr presidente, tenga la palabra de fuerza"
1317863479194330112,"@usuario Sembrando odio? Solo porque quiere acabar con los violentistas antifas que destruyen? Odio porque quiere regularizar la inmigración descontrolada que sufre EEUU? Odio porque defiende la familia y los valores cristianos de EEUU? Amigo, cambie CNN y vea otro tipo de noticias."
1248150883134850048,"Ser estadounidense y zurdo debería ser considerado un crimen. Y sobre todo si sos inmigrante, y SOBRE TODO si sos latino."
1380892419626010112,"el fomento de los sindicatos de clase como jaurías callejeras al servicio de la extrema izquierda a costa del dinero público, el derroche de las reservas para futuras pensiones, el inicio de un infame plan para comprar a través de falsas ONGs, 1 millón de inmigrantes (sigue)"
1176531787771760128,"@usuario cuánta más sangre de los peruanos quiere?? De la cara. Póngase firme. Ordene la política migratoria. Si usted no puede, hágase a un costado."
1227254385962609920,Pero hashtag el cacas puso a la inútil y espurea @usuario para quedar bien con su pasado comunista y terrorista. No es lo mismo asesinar y poner bombas que cuidar migrantes. No es lo mismo. hashtag 4ta transformacion hashtag 4tadefecacion
1139658342937309952,"@usuario @usuario @usuario @usuario Ese tal Tonatiuh! Más bien fue protector, defensor de migrantes! Toleró todas las caravanas! Aquí en mi pueblo Mapastepec por alojar migrantes paso por encima de los derechos de los que aquí vivimos"
1215573832074789888,"@usuario Es que tu no distingues chile de venezuela. No quieres hacerlo, ni te interesa. Yo contrate un venezolano pobre. Me gustaria que hablaras con el para que aprendas algo"
1170329496408480000,"@usuario @usuario Eres un chiste que se avergüenza de tu apellido paterno (Perez, mas cercano de ser Chileno) y usa su apellido de migrante para sentirse ""Europeo"". Sabias que los decendientes de alemanes somos tecnicamente ""migrantes""??"
1121327312241190016,@usuario @usuario @usuario Porfavor hagan algo ya con esto. Que estan esperando a que el pais colapse? No se han dado cuento como se encuentran los países que han abierto sus fronteras a inmigrantes? No han visto en lo que se a convertido Alemania y Sweeden donde la criminalidad se ha disparado?
1243499418046870016,Cierre de fronteras y mucho autoritarismo. No quiero un pais donde el fin justifica los medios!!
1239153799777880064,"@usuario Joder esto es muy fácil, quieren independencia, no hacen caso, cierre de fronteras y selección natural"
1229263057060189952,@usuario Ojalá vaya algún día a Venezuela donde viven 6 millones de colombianos que prefieren resistir antes que regresar. Esos 6 millones de colombianos también le quitan el trabajo a millones de venezolanos.
1197730244062520064,Apoyaron la migración venezolana y ahora esos mismos crearon bandas de pandillas para saquear los países fronterizos. Que vergüenza.
1113892543543030016,@usuario @usuario @usuario Hay que cerrar nuestra frontera sur!! Ni modo..la ley de supervivencia!!🤷 emoji tono de piel claro emoji ‍
1370540868843760128,Bien echo piñera por fin detendremos la migración ilegal
1366040904650400000,@usuario hay un movimiento que es &quot;Rio de Janeiro es TU país&quot; que el resto de Brasil le pide que se separe y construya un muro gigante en su frontera
1201651592858080000,"POR FAVOR QUE SE LARGUEN TODOS DE UNA BUENA VEZ. TENGAN UN MÍNIMO DE DIGNIDAD Y VÁYANSE A LA MIERDA! NI SUS PROPIAS MADRES CREERÁN MAS EN UDS, LÁRGUENSE DE MI PAÍS, DAN ASCO, REPUGNAN, LOS ODIAAMOSS A TODOS. RENUNCIEN YAA!!"
1099293831676210048,"Pregunta Para Dummies: Si @usuario ordeno al ejército de EEUU disparar contra los migrantes desarmados que pretendieran ingresar a USA, por qué el Dr Maburro no puede ordenar lo mismo para hashtag venezuela ? Es para una tarea."
1318948500458119936,"@usuario Error, no fue la POLITICA DE TRUMP, fue la decisión de sus padres al llevarlos violando las leyes de inmigracion de un país extranjero. No cambien las realidades para desinformación de incautos y contradictores de las normas."
1340509566983940096,@usuario Te falto mencionar lleno de ladrones narcos traficante de inmigrantes roba cuentas de afp apitutados en el estado y tanto de lo que formas parte ! Corrupción
1190638022498409984,cerrar las fronteras!! 2020 es ya!!@usuario @usuario @usuario @usuario @usuario @usuario @usuario @usuario
1150739613524339968,@usuario @usuario @usuario @usuario : Uds q son abanderados de la caridad por migración venezolana? Por qué no se llevan a estos angelitos a sus casas?
1209014027617220096,"Felicidades ,una vez más, por el programa de ayer y cómo se trató el fenómeno migratorio que tanto afecta a la seguridad nacional. @usuario @usuario hashtag inmigración hashtag seguridad nacional hashtag fronteras hashtag ue hashtag crimen organizado hashtag yihadismo"
1358875691517959936,"@usuario @usuario Te recuerdo q Gye., tiene millones migrantes internos, de costa y sierra, gente que llego a vivir a los cinturones de miseria q rodean a la ciudad, gente q lamentablemente no tiene educación., peor sabe de politica, o tener un criterio, sobre pillo como RC y su banda"
1210773900222589952,@usuario @usuario @usuario Muro de trump pepr incompleto siguen pAsando migrantes drogas y armas
1375665213375140096,@usuario @usuario A eso súmale la llegada de inmigrantes.
1313263628741570048,"""La tierra es de quien la trabaja"", dijo nuestro querido Zapata, así que lo mejor sería que los migrantes que vienen en camino ocupen las carpas de la ignominiosa performance.."
1219253403274089984,"@usuario @usuario ¿El Capitalismo viola? No tiene sentido lo que dices. Compara los datos de violaciones antes de la llegada de inmigrantes durante el hashtag welcomerefugees y después de este, verás que la casualidad queda bastante reducida."
1180956138722020096,"PRESIDENTE TRUMP, CUIDA los IMPUESTOS con diente y muelas, SUSPENDE entrada a EE.UU a INMIGRANTES que NO puedan PAGARAE su SALUD @usuario url"
1354461727434400000,"@usuario Que estas haciendo para que el gobierno Venezolano cumpla con su responsabilidad de mantener a su gente? Venezuela apoyado de Ecuador envía a Venezolanos a Perú donde no hay trabajo ni para nosotros, eso no ayuda a los venezolanos y nos perjudica, apoyar eso es estúpido"
1137353868797330048,"@usuario Es necesario que otro gobierno..los ponga a trabajar por el bien de los mexicanos primero ,después los migrantes"
1357337901399500032,"NORTE: Migración ILEGAL masiva SUR: TERRORISMO CENTRO: PORTONAZOS, Detenciones ciudadanas @usuario con 13% aprobación qué espera para darle atribuciones a @usuario y terminar con el @usuario ? PERDÓN pero de parte de quién está UD? hashtag el peor gobierno de la historia url"
1227520215166149888,"@usuario @usuario @usuario Así como dice usted @usuario alguien miente.. mi percepción es, la inseguridad en Barranquilla es una cosa de locos,la migración incontrolada ha traído tanta violencia, el desempleo la informalidad crecen es solo mirar cada esquina. La salud ni hablar atención pésima. url"
1149421013915949952,Será por los flojos del gobierno mexicano que no hacen su trabajo para detener la migración
1191832440383439872,"Le tengo más miedo a la policía que al narco así que no gracias Trump, por mi que tus militares ni se asomen a la frontera o les ponemos un muro emoji cara con ojos en blanco emoji ."
1274606388971549952,@usuario Que bonito es el buenísmo con los inmigrantes delincuentes
1137571997947480064,"@usuario @usuario Pues pida disculpas y siéntese, porque gran parte de esta situación la tiene AMLO al haber ofrecido trabajo a los migrantes, cuando no puede dárselos a los mexicanos."
1264279522595219968,"@usuario @usuario De hecho, tendrá que hacerlo SÍ O SÍ. Argentina estaba mal antes de la Pandemia, ahora se está hundiendo más, y eso significa migración masiva ootra vez emoji cara haciendo una mueca emoji emoji manos en oración tono de piel claro emoji"
1386795141244009984,"@usuario Es verdad, en ésta vida nada es Gratis, por algún ladito te lo cobran después. Me hizo acordar del vídeo de la Sra Veneca q vivía en Cúcuta, creo q ya se fue, cómo Renegaba, porque acá en Colombia todo lo cobran, Internet, Parábolica, Gas, Luz, Agua, Arriendo y allá No pagaba."
1238133120815239936,Es necesario tomar previsiones @usuario ante un brote masivo de coronavirus. Cierre de fronteras ya! Dejen el patebolismo la vaina es sería @usuario @usuario @usuario
1168190684098190080,"@usuario La mayoría de los Uruguayos no estamos en contra de los inmigrantes.o que si es en contra de los empresarios que se aprovechan y toman solamente extranjeros porque como precisan trabajan doble turno, no se sindicalisan, etc,etc.,,."
1120692709017170048,La inmigración llegó para quedarse. Es parte de la globalización y del siglo XXI. O nos adaptamos como sociedad o le damos cada vez más espacio a la xenofobia y a ese tipo de odiosidades que deberían estar sepultadas hace rato emoji cara sin expresión emoji emoji cara sin expresión emoji .
1262028476426710016,La inmigracion debe ser controlada nos hace falta en Chile. Gasfiters ? No. Medicos especialistas ? Sí. Mano de obra No calificada ? No. Empresarios de vengan a crear fuentes de empleos ? Sí.
1151496295720400000,"La pregunta que muchos nos hacemos es ¿Por qué hay dinero para migrantes y no para los mexicanos? No sólo en el deporte, apoyo en general. url"
1084140051980800000,"Aqui pensando en Trump y las ganas que posee de levantar ese muro. Ahora es cuando.. que se sienta el power mexicano. Salgan de ese país y déjenlos siendo lo que son.. que se den cuenta donde está su riqueza, que no son nada sin los inmigrantes."
1202282229029890048,"@usuario @usuario @usuario A mi lo que me parece curioso es lo de la secta al sacar la información con la nacionalidad, ¿que buscaba? Porque ya sabemos que la secta no saca nunca la nacionalidad de los delincuentes, con el objetivo de no atacar a los ""pobres inmigrantes""."
1123412902680109952,"url pq será que el GobCubano se niega a díalogar con los cubanos que reclamamos un salario justo, el fin de los muros antimigrantes y la extremacensura y exclcuión?? pq será que el gobCubano cierra las puertas a los cubanos"
1179135834353750016,"Lo bueno es que los venezolanos se irán de Perú. Y lo malo, la sra diputada se queda. Es lo realmente bueno. (VIDEO) Diputada xenófoba peruana pide cerrar las fronteras y expulsar a los venezolanos ""malos o buenos"" url"
1191494358194970112,Me quejo de los inmigrantes durante todo el directo y después me llaman racista?!?!?
1362556266451780096,@usuario @usuario @usuario Llévate a los MIGRANTES a tu casa. No Queremos MIGRANTES ilegales
1085974145295399936,@usuario @usuario Es autoatentado!! Encontraron disque pasaportes venezolanos. Para generar más xenofobia!!
1144052483221849984,"Gobierno va por más despidos emoji signo de exclamación emoji La SHCP asegura que los recursos son insuficientes para programas sociales; estiman correr a 5 mil más. Una pregunta, invertir en estudiantes borrachos, inmigrantes y estadios de baseball, es redituable? hashtag amlotraidor mx url"
1334684553168920064,Ya saben por qué tan amables con las caravanas de migrantes y las montones de dinero a El Salvador? Van a llegar miles de personas a hacerse ciudadanos mexicanos. Y saben por quién van a votar?
1268200610115010048,"@usuario @usuario Los venezofachos no son todos los venezolanos, son los que se vinieron a Chile a buscar el oasis que nunca existió, la mayoría de los venezolanos en Chile = Venezofachos"
1347026337870050048,@usuario Jjaja el colmo .. no hay ni para nosotros y este imbécil quiere vacunar hasta a los migrantes .. Porfavor Dios ya llévatelo emoji manos en oración tono de piel claro emoji emoji manos en oración tono de piel claro emoji
1145852381512569984,@usuario Deberían darse una vuelta por todos los clubes (table) o go go dance de la Ciudad de México donde están migrantes ilegales..
1309931367363419904,"@usuario @usuario las fronteras son un problema no hay duda sobre ello, pero para mi ponen en competencia a quien quiera cruzarla tanto como violar la seguridad de su pais e la emigración ilegal de cumplir el sueno americano."
1166737093797799936,"@usuario @usuario @usuario @usuario @usuario Decir la verdad es malo?, decir que un ciudadano colombiano, venezolano, paraguayo robo, asesino los convierte a todos en asesinos?. ""Perú: cifras históricas de desempleo en medio de una estampida migratoria"" url"
1304816494786769920,@usuario @usuario @usuario Cuando un colombiano iba a Venezuela si no tenía sus papeles le tocaba escondersede la guardia venezolana por por que se creian el puta haciendo valer sus reglas pero los venezolanos yegaron a combia y nadie los sacó por el contrario an tenido más ayudas que yo que soy emoji bandera colombia emoji
1140633022229880064,@usuario @usuario Muy tarde empezaron a pedir visa eso debió ser desde el primer día. Además debe cerrar las fronteras nadie debe ingresar es un caos Lima .
1341243893254390016,"No le veo la xenofobia al hecho de no otorgarle vacunas a los migrantes, cada Estado está en la obligación de responder por los suyos."
1320235665506840064,"La indignación de la gente del pro es muy selectiva, les duele q este gobierno traiga a 1 persona (ex presidente y bajo riesgo de vida) pero no los 1600 que trajo el pro como refugiados. url"
1257075234978619904,@usuario @usuario @usuario Verdad que leyendo ciertos comentarios los problemas de los venezolanos en el Perú se reduce a criterios osmelsoucista o miss Venezuela incluido pedicure y manicure. Verdad y con todo respeto el venezolano es bastante superficial y simple incluso para asumir su propia tragedia.
1139573002457229952,Aun no pasa un año de esto y ya se les olvidó.. Ahora si quieren sacar migrantes de Chile.. como dice que dijo. Pa donde calienta el sol
1154739671030739968,"hashtag abajolosmatinales q son títeres de hashtag la moneda para desviar todos sus cagazos hashtag essal y agua negra en hashtag osorno hashtag mañalich y su frase para el bronce x hashtag transplante hashtag desempleo y alza brutal en Gran Stgo hashtag inmigración tapada con 1 dedo o debajo la alfombra Reprobación al Gobierno, etc"
1357357068550889984,"@usuario nos podemos quedar con esa sola frase de kkast desafortunada..pero el trasfondo igual es cierto, si no se regulariza y se establecen limites a la inmigración ilegal, va a haber un colapso en la zona norte, especialmente porque muchos de ellos vienen en precarias condiciones"
1137438802421740032,@usuario @usuario @usuario @usuario Porsupuesto!! Es absurdo pensar en que esto es un acierto!! Nos salvamos!! Pero nada de esto habría sucedido de no ser por la migración indiscriminada permitida e incentivada por nuestro gobierno
1107489364236519936,@usuario Bueno prepare se a recibir 15 millones de venezolanos desplazados.
1311096767207869952,"@usuario Me da terror pensar que esas personas vienen por un motivo, he leído muchos tw de los mismos venezolanos viviendo en chile años, dicen que nada bueno viene de los que exigen entrar al país hoy !"
1199842050193139968,"@usuario @usuario Es un ataque de la Onu globalista..nos salió caro no haber firmado el Pacto Migratorio. Por eso quieren imponer cambio constitución, entre otras cosas para quitarle al ejecutivo la posibilidad de elegir, privilegiar su país y no someterse a la agenda globalista 2030"
1359520653938929920,"Álvaro Bellolio y Ley de Migración: ""Muy felices de terminar una tramitación de casi 8 años"" url a través de @usuario hashtag venezolanos . El frente amplio, PC, PS piden al Tribunal Constitucional bonos para los indocumentados !! Nefastos emoji cara cabreada emoji emoji persona haciendo el gesto de no emoji hay que sacarlos"
1151565133191299968,"@usuario @usuario @usuario No es más que el fruto de las acciones de este gobierno, a la gente no le gustó nada que se les diera dinero a los migrantes, ni que haya carencias en salud mientras se regalan 30M. Además de fomentar el odio entre mexicanos, también se fomentó hacia el migrante centroamericano."
1198943975668879872,"@usuario Porque culpan a otros de las decisiones del gobierno. El señor @usuario le abrió las fronteras, nuestro país no es capaz de cubrir las necesidades básicas de los colombianos, ahora va a ser capaz de cubrir las de los migrantes venezolanos."
1343622342476489984,"@usuario @usuario @usuario El problema SÍ es la inmigración ilegal. Le guste aceptarlo o no. Y además, cual es la ventaja de aprender ese idioma? El inglés es mas global"
1282082983315419904,@usuario @usuario @usuario @usuario @usuario A ver!! El dinero de los inmigrantes!! Pinche Ratona!! No miras que tú Cola cagada hasta da vuelta en la manzana? Ah!! Pero crees q No tenemos memoria? @usuario hashtag ratadel prian url
1156085140101189888,"@usuario no es su calidad de inmigrante, sino las repercusiones de inmigración masiva"
1249354211445349888,@usuario @usuario Piden respeto por los venezolanos que hay aka en Perú cuando la mayoría vino a delinquir para poder tener para las drogas y el alcohol les gusta la vida fácil
1220040265999709952,Guardia Nacional repliega Caravana Migrante 2020 url vía @usuario poca m&amp;$//(-) de esta gente todavía de que los mexicanos les damos alimentos por cómo vienen agraden a nuestras autoridades porque no se quedan en su país y pelean así con su gobierno también
1375244539296900096,"Lanzo como propuesta una Reforma Migratoria Integral que sea un primer paso para establecer unos mecanismos serios de ingreso al país, para la protección de miles de familias Colombianas; NO podemos callarnos ante esa delincuencia Venezolana que nos desangra día tras día."
1310564666050070016,@usuario Pa saber que a esos son los que joden en los puestos de migración emoji cara llorando de risa emoji La gaminería garantiza pasar derecho
1374722740968640000,"@usuario Principalmente de los honorables ""inmigrantes"" colombianos y venezolanos"
1205885707421700096,"@usuario Lo felicito, descubrió el agua tibia. Ud. lleva dos décadas aprox. como concejal de Bogotá, muestre por lo menos un anteproyecto de acuerdo de su autoría con el que se quiera solucionar esta problemática. Ni siquiera analiza que hay casi 1 millón de venezolanos en Bogotá. Ay!"
1139036782824230016,@usuario La 4T quiere obtener dinero a cómo de lugar para mantener a los migrantes
1152813500093360000,"@usuario Completamente de acuerdo. Claro que la inmigración es un aporte pero, como dices, más regulada sino va a ser caldo de cultivo para la extrema derecha. Qué pretende entonces el PC, senador Navarro y otros? Quizás les sirve que surjan liderazgos fascistas. A Chile no."
1359141368405370112,"@usuario @usuario @usuario Total ya existía y seguirá existiendo, pero es un hecho que se ha aumentado muchísimo o va a decir que la mendicidad no aumentó? Los robos el micro tráfico no ha aumentado? Porque la gente no los quiere? La xenofobia se da contra el venezolano de mal no contra el que hace el bien"
1260670402357070080,@usuario @usuario @usuario @usuario @usuario @usuario @usuario @usuario @usuario @usuario @usuario @usuario @usuario @usuario jaja si si campeon ahora cuentanos una de vaqueros. alla hubieron 125 mil peruanos en su mejor momento de los cuales no quedan ni la sexta parte. aqui los venezolanos ya superan el millon
1266442842311930112,@usuario @usuario En serio? Y los q cruzan las fronteras todos los dias? Somos nosotros culpables?
1359221009786800128,"Es injusto, el gobierno quiere favorecer a 1. 7 millones de venezolanos. Acá no tenemos sistema de salud, hay 4millones de desempleados. Maldito Duque. Maduro amo y señor de Venezuela esta feliz de la estupidez de IVÁN Duque,"
1221577394030569984,"@usuario @usuario la mayoría que han tirado la comida fueron los hondureños los del SALVADOR Y GUATEMALA no se les a visto eso, a lo mejor son mas acomplejados"
1161441384919970048,"@usuario erickchba2 @usuario Pero muchos de los militantes progresistas en los medios de comunicación o la academia ahora están defendiendo a los &quot;inmigrantes indocumentados&quot;. No hay &quot;indocumentados&quot;, son ilegales."
1113305032995340032,¿No que no iba a endeudar a México? Pero ahí lo tienen ofreciendo trabajo y dinero a migrantes. hashtag opcmx
1355250287339059968,@usuario Después de que Ud y su partido prácticamente obligaron a ppk a recibir a los venezolanos y hasta llegaron a la huachafada de izar la bandera venezolana en el partido aprista vienen ahora a pretender que nos olvidemos de eso?
1175943809299030016,Sí es cierto que Perú muchos odian a los venezolanos pero estos también se han ganado el odio de muchos por sus actitudes o acciones que Venezuela sea tierra de nada no quiere decir que los demás países lo sean emoji cara con ojos en blanco emoji
1359163454171529984,@usuario @usuario emoji alto voltaje emoji emoji alto voltaje emoji Chiste o burla? En un par de días solo a Colchane han ingresado alrededor de 1.800 migrantes. Quieren hacernos creer que los otros miles vienen con papeles en regla y contrato de trabajo? @usuario @usuario @usuario
1357080129432859904,"@usuario En Formosa solo votan los paraguayos q cruzan las fronteras por los planes sociales, no votan formoseños"
1279422835614799872,El pastizal que se han llevado las ONG que han trasladado inmigrantes ilegales contagiados por Coronavirus durante el Estado de Alarma url
1137582113178259968,"@usuario Me parece lo mejor para la integridad de la relación política y comercial entre ambos países, la inmigración ilegal y descontrolada es un problema."
1123232837568739968,"@usuario @usuario @usuario @usuario @usuario @usuario Por ejemplo, en el tema de las violaciones grupales si que tengo datos a mano -de lo otro tendría que buscar-, y un 50%, con un 22% de magrebies, serían inmigrantes, o sea, que un 10% más o menos de la población estaría cometiendo un 50% de las agresiones url"
1270509512223579904,@usuario Un día un VENEZOLANO me asaltó en mi país y otro amigo de ese ladrón me dijo que me acostumbre ya que SIEMPRE me iban a asaltar en mi país pues habían venido a eso. Yo nunca le creí a ese par de delincuentes y hoy en día aprecio mucho a los inmigrantes y sé que son gente de bien.
1163958312322439936,"Algo le aprendieron a Chávez, que cedulaba en Cúcuta y Maicao, al igual que a los Colombianos migrantes en situación económica deficitaria en el interior del país. Eso de no volvernos como Venezuela realmente tuvo el efecto contrario, las similitudes son casi innumerables Chamo."
1178722839110789888,@usuario Maldito régimen uds no pueden ni emitir una palabra x su culpa estamos en esta debacle sin luz gasolina agua etc son una calamidad un desastre una maldición..coño váyanse dejemos vivir en pazz!!El interior del país clama por justicia
1359704437539950080,@usuario Ellos tiene bastante espacio para recibir inmigrantes!! tendríamos que decirles que serán recibidos con los brazos abiertos
1144267128603859968,"LAS OLIGARQUIAS Y ANTINACIONALISTA PITIYANKIS,,MAS APROVECHADORES DE LA VIDA FACIL,,COMO UNION EUROPEA,,EEUU,,ISRAEL,,MAS LOS QUE VIVEN EN VENEZUELA,,COMERCIANTES Y MIGRANTES,,BACHAQUEROS Y LAVA$$,,TUMBAN GOBIERNOS PARA PODER ELIMINAR LA CONSTITUCION Y ROBAR LIBREMENTE,,."
1245938019523160064,"@usuario @usuario El problema de los venezolanos es problema de Venezuela, los colombiano ya han sido muy generosos, amables y buenos pero ni a un bogotano pobre, la alcaldía le ha dado tanto como a un venezolano. Una cosa es ayudar y otra es mantener."
1106567317822099968,"la punta del iceberg de INMIGRANTES llega a la frontera de tamaulipas con texas centros de retención en texas rebasados por la cantidad de personas arrestadas , mientras tanto la frontera sur de méxico abierta al paso de TODO el mundo"
1137034925696150016,"Senadora estas segura que estas personas no trafican, o tienen beneficios personales para promover el supuesto derecho de migrantes, ahora y el derecho de un país? de los ciudadanos a vivir en paz. El derecho de ellos llega justo hasta donde llegan lo de los ciudadanos de un país"
